Cloudy with a Chance of Meatballs,2009-09-17,100000000,"Bill Hader, Flint Lockwood / FLDSMDFR (voice), Anna Faris, Sam Sparks (voice), James Caan, Tim Lockwood (voice), Neil Patrick Harris, Steve the Monkey (voice), Andy Samberg, Brent McHale (voice), Mr. T, Officer Earl Devereaux (voice), Bruce Campbell, Mayor Shelbourne (voice), Bobb'e J. Thompson, Calvin ""Cal"" Devereaux (voice), Benjamin Bratt, Manny (voice)","Animation, Comedy, Family",6.6
Alice in Wonderland,1951-07-28,3000000,"Mia Wasikowska, Alice Kingsleigh, Johnny Depp, The Mad Hatter, Anne Hathaway, The White Queen, Helena Bonham Carter, The Red Queen, Crispin Glover, The Knave of Hearts, Matt Lucas, Tweedledee / Tweedledum, Alan Rickman, The Caterpillar (voice), Stephen Fry, The Cheshire Cat (voice), Michael Sheen, The White Rabbit (voice)","Family, Fantasy, Adventure",7.185
Pinocchio,1940-02-23,2600000,"Benjamin Evan Ainsworth, Pinocchio (voice), Tom Hanks, Geppetto, Joseph Gordon-Levitt, Jiminy Cricket (voice), Luke Evans, The Coachman, Cynthia Erivo, Blue Fairy, Keegan-Michael Key, 'Honest' John (voice), Lorraine Bracco, Sofia the Seagull (voice), Kyanne Lamaya, Fabiana, Angus Wright, Signore Rizzi","Fantasy, Adventure, Family",7.102
Moonrise Kingdom,2012-05-16,16000000,"Jared Gilman, Sam Shakusky, Kara Hayward, Suzy Bishop, Edward Norton, Scout Master Ward, Bill Murray, Mr. Bishop, Frances McDormand, Mrs. Bishop, Bruce Willis, Captain Sharp, Tilda Swinton, Social Services, Jason Schwartzman, Cousin Ben, Bob Balaban, The Narrator","Comedy, Drama, Romance",7.69
Ender's Game,2013-10-24,110000000,"Asa Butterfield, Ender Wiggin, Harrison Ford, Colonel Hyrum Graff, Hailee Steinfeld, Petra Arkanian, Viola Davis, Major Gwen Anderson, Abigail Breslin, Valentine Wiggin, Ben Kingsley, Mazer Rackham, Aramis Knight, Bean, Moisés Arias, Bonzo Madrid, Nonso Anozie, Sergeant Dap","Science Fiction, Action, Adventure",6.59
The Devil's Advocate,1997-10-17,57000000,"Keanu Reeves, Kevin Lomax, Al Pacino, John Milton, Charlize Theron, Mary Ann Lomax, Jeffrey Jones, Eddie Barzoon, Judith Ivey, Alice Lomax, Connie Nielsen, Christabella Andreoli, Craig T. Nelson, Alexander Cullen, Tamara Tunie, Mrs. Jackie Heath, Ruben Santiago-Hudson, Leamon Heath","Drama, Mystery, Thriller, Horror",7.451
The Girl on the Train,2016-10-05,45000000,"Emily Blunt, Rachel Watson, Rebecca Ferguson, Anna Watson, Haley Bennett, Megan Hipwell, Justin Theroux, Tom Watson, Luke Evans, Scott Hipwell, Allison Janney, Detective Sgt. Riley, Edgar Ramírez, Dr. Kamal Abdic, Lisa Kudrow, Martha, Laura Prepon, Cathy","Thriller, Mystery, Drama",6.434
Mortal Kombat,2021-04-07,20000000,"Lewis Tan, Cole Young, Jessica McNamee, Sonya Blade, Josh Lawson, Kano, Joe Taslim, Bi-Han / Sub-Zero, Mehcad Brooks, Jax Briggs, Matilda Kimber, Emily Young, Laura Brent, Allison Young, Tadanobu Asano, Lord Raiden, Hiroyuki Sanada, Hanzo Hasashi / Scorpion","Action, Fantasy, Adventure",7.081
Van Helsing,2004-05-05,160000000,"Hugh Jackman, Van Helsing, Kate Beckinsale, Anna Valerious, Richard Roxburgh, Count Vladislaus Dracula, David Wenham, Carl, Shuler Hensley, Frankenstein's Monster, Elena Anaya, Aleera, Will Kemp, Velkan, Kevin J. O'Connor, Igor, Alun Armstrong, Cardinal Jinette","Horror, Adventure, Action",6.324
The Conjuring: The Devil Made Me Do It,2021-05-25,39000000,"Patrick Wilson, Ed Warren, Vera Farmiga, Lorraine Warren, Ruairí O'Connor, Arne Cheyne Johnson, Sarah Catherine Hook, Debbie Glatzel, Julian Hilliard, David Glatzel, John Noble, Father Kastner, Eugenie Bondurant, The Occultist, Shannon Kook, Drew Thomas, Ronnie Gene Blevins, Bruno","Horror, Mystery, Thriller",7.491
From Dusk Till Dawn,1996-01-19,19000000,"George Clooney, Seth Gecko, Quentin Tarantino, Richard Gecko, Harvey Keitel, Jacob Fuller, Juliette Lewis, Kate Fuller, Ernest Liu, Scott Fuller, Salma Hayek, Santanico Pandemonium, Cheech Marin, Border Guard/Chet Pussy/Carlos, Danny Trejo, Razor Charlie, Tom Savini, Sex Machine","Horror, Action, Thriller, Crime",7.0
"I, Tonya",2017-12-08,11000000,"Margot Robbie, Tonya Harding, Sebastian Stan, Jeff Gillooly, Allison Janney, LaVona Golden, Julianne Nicholson, Diane Rawlinson, Paul Walter Hauser, Shawn Eckhardt, Bobby Cannavale, Martin Maddox, Bojana Novaković, Dody Teachman, Mckenna Grace, Tonya Harding (8-12 Yrs), Caitlin Carver, Nancy Kerrigan",Drama,7.501
The Dictator,2012-05-15,65000000,"Sacha Baron Cohen, Aladeen / Efawadh, Ben Kingsley, Tamir, Anna Faris, Zoey, Jason Mantzoukas, Nadal, Sayed Badreya, Omar, Adeel Akhtar, Maroush, Aasif Mandvi, Doctor, Rizwan Manji, Patient, Rocky Citron, Baby Aladeen",Comedy,6.173
Manchester by the Sea,2016-11-18,9000000,"Casey Affleck, Lee Chandler, Lucas Hedges, Patrick Chandler, Michelle Williams, Randi Chandler, Kyle Chandler, Joe Chandler, C.J. Wilson, George, Gretchen Mol, Elise Chandler, Heather Burns, Jill, Ivy O'Brien, Young Patrick Chandler, Josh Hamilton, Wes (Joe's Lawyer)",Drama,7.5
Hulk,2003-06-19,137000000,"Eric Bana, Bruce Banner / Hulk, Jennifer Connelly, Betty Ross, Sam Elliott, Thaddeus E. ""Thunderbolt"" Ross, Josh Lucas, Glenn Talbot, Nick Nolte, David Banner, Paul Kersey, Young David Banner, Cara Buono, Edith Banner, Kevin Rankin, Harper, Todd Tesen, Young Ross","Science Fiction, Adventure, Action",5.5
Enemy,2013-12-31,0,"Jake Gyllenhaal, Adam Bell / Anthony Claire, Mélanie Laurent, Mary, Sarah Gadon, Helen Claire, Isabella Rossellini, Adam's Mother, Joshua Peace, Carl, Tim Post, Anthony, Kedar Brown, Security Guard, Darryl Dinn, Video Store Clerk, Megan Mane, Lady in the Dark Room","Thriller, Mystery",6.873
Game Night,2018-02-15,37000000,"Jason Bateman, Max Davis, Rachel McAdams, Annie Davis, Kyle Chandler, Brooks Davis, Billy Magnussen, Ryan Huddle, Sharon Horgan, Sarah Darcy, Lamorne Morris, Kevin Sterling, Kylie Bunbury, Michelle Sterling, Jesse Plemons, Gary Kingsbury, Danny Huston, Donald Anderton","Mystery, Comedy, Crime",6.85
The Interview,2014-12-25,44000000,"James Franco, Dave Skylark, Seth Rogen, Aaron Rapaport, Lizzy Caplan, Agent Lacey, Randall Park, Kim Jong-un, Diana Bang, Sook, Timothy Simons, Malcolm, Reese Alexander, Agent Botwin, James Yi, Officer Koh, Paul Bae, Officer Yu","Action, Comedy",6.185
Hitch,2005-02-11,70000000,"Will Smith, Alex 'Hitch' Hitchens, Eva Mendes, Sara Melas, Kevin James, Albert Brennaman, Amber Valletta, Allegra Cole, Julie Ann Emery, Casey Sedgewick, Adam Arkin, Max, Robinne Lee, Cressida Baylor, Nathan Lee Graham, Geoff, Michael Rapaport, Ben","Comedy, Drama, Romance",6.551
Live Free or Die Hard,2007-06-20,110000000,"Bruce Willis, John McClane, Justin Long, Matthew 'Matt' Farrell, Timothy Olyphant, Thomas Gabriel, Cliff Curtis, Bowman, Maggie Q, Mai Linh, Mary Elizabeth Winstead, Lucy McClane, Kevin Smith, The Warlock, Christina Chang, Taylor, Sung Kang, Raj","Action, Thriller",6.606
Jason Bourne,2016-07-27,120000000,"Matt Damon, Jason Bourne, Tommy Lee Jones, Robert Dewey, Alicia Vikander, Heather Lee, Vincent Cassel, Asset, Julia Stiles, Nicky Parsons, Riz Ahmed, Aaron Kalloor, Joe Kennard, Athens Bravo Agent, Amy De Bhrún, Hub Tech, Ato Essandoh, Craig Jeffers","Action, Thriller, Mystery",6.329
Training Day,2001-10-05,45000000,"Denzel Washington, Alonzo Harris, Ethan Hawke, Jake Hoyt, Scott Glenn, Roger, Tom Berenger, Stan Gursky, Harris Yulin, Doug Rosselli, Raymond J. Barry, Lou Jacobs, Cliff Curtis, Smiley, Dr. Dre, Paul, Snoop Dogg, Blue","Action, Crime, Drama",7.485
Taken 3,2014-12-16,48000000,"Liam Neeson, Bryan Mills, Forest Whitaker, Inspector Franck Dotzler, Famke Janssen, Lenore Mills - St. John, Maggie Grace, Kim Mills, Dougray Scott, Stuart St. John, Sam Spruell, Oleg Malankov, Don Harvey, Garcia, Dylan Bruno, Smith, Leland Orser, Sam (Gilroy)","Thriller, Action",6.234
Hotel Transylvania 2,2015-09-21,80000000,"Adam Sandler, Dracula (voice), Andy Samberg, Johnny Loughran (voice), Selena Gomez, Mavis Dracula (voice), Kevin James, Frankenstein (voice), Steve Buscemi, Wayne (voice), David Spade, Griffin (voice), Keegan-Michael Key, Murray (voice), Asher Blinkoff, Dennis (voice), Fran Drescher, Eunice (voice)","Animation, Comedy, Family, Fantasy",6.8
Interview with the Vampire,1994-11-11,60000000,"Brad Pitt, Louis de Pointe du Lac, Tom Cruise, Lestat de Lioncourt, Kirsten Dunst, Claudia, Antonio Banderas, Armand, Christian Slater, Daniel Malloy, Stephen Rea, Santiago, Thandiwe Newton, Yvette, Domiziana Giordano, Madeleine, Sara Stockbridge, Estelle","Horror, Drama, Fantasy",7.38
The Bourne Legacy,2012-08-08,130000000,"Jeremy Renner, Aaron Cross, Rachel Weisz, Dr. Marta Shearing, Edward Norton, Byer, Scott Glenn, Ezra Kramer, Donna Murphy, Dita Mandy, Joan Allen, Pamela Landy, Nilaja Sun, Blue Lab Doctor, Albert Finney, Dr. Albert Hirsch, Michael Chernus, Arthur Ingram","Action, Thriller",6.216
Jumper,2008-02-13,85000000,"Hayden Christensen, David Rice, Jamie Bell, Griffin, Samuel L. Jackson, Roland, Rachel Bilson, Millie Harris, Michael Rooker, William Rice, Diane Lane, Mary Rice, AnnaSophia Robb, Young Millie, Max Thieriot, Young David, Jesse James, Young Mark","Action, Adventure, Science Fiction",6.142
King Arthur: Legend of the Sword,2017-05-10,175000000,"Charlie Hunnam, Arthur, Astrid Bergès-Frisbey, The Mage, Jude Law, Vortigern, Djimon Hounsou, Bedivere, Eric Bana, Uther, Aidan Gillen, Bill, Mikael Persbrandt, Greybeard, Annabelle Wallis, Maggie, Peter Ferdinando, Earl of Mercia","Action, Drama, Fantasy",6.536
Kung Fu Panda 3,2016-01-23,145000000,"Jack Black, Po (voice), Bryan Cranston, Li Shan (voice), Dustin Hoffman, Shifu (voice), Angelina Jolie, Tigress (voice), J.K. Simmons, Kai (voice), Jackie Chan, Monkey (voice), Seth Rogen, Mantis (voice), Lucy Liu, Viper (voice), David Cross, Crane (voice)","Action, Adventure, Animation, Comedy, Family",6.878
Stand by Me,1986-08-08,8000000,"Wil Wheaton, Gordie Lachance, River Phoenix, Chris Chambers, Jerry O'Connell, Vern Tessio, Corey Feldman, Teddy Duchamp, Kiefer Sutherland, Ace Merrill, Casey Siemaszko, Billy Tessio, Gary Riley, Charlie Hogan, Bradley Gregg, Eyeball Chambers, Jason Oliver, Vince Desjardins","Crime, Drama",7.856
Ace Ventura: Pet Detective,1994-02-04,15000000,"Jim Carrey, Ace Ventura, Courteney Cox, Melissa Robinson, Sean Young, Lt. Lois Einhorn, Tone Loc, Emilio, Noble Willingham, Riddle, Dan Marino, Himself, Troy Evans, Roger Podacter, Raynor Scheine, Woodstock, Udo Kier, Ron Camp","Comedy, Adventure",6.544
Pocahontas,1995-06-14,55000000,"Irene Bedard, Pocahontas (voice), Mel Gibson, John Smith (voice), David Ogden Stiers, Governor Ratcliffe (voice), John Kassir, Meeko (voice), Christian Bale, Thomas (voice), Judy Kuhn, Pocahontas (singing voice), Billy Connolly, Ben (voice), Frank Welker, Flit (voice), Russell Means, Powhatan (voice)","Adventure, Animation, Family, Romance",6.926
Paul,2011-02-14,40000000,"Simon Pegg, Graeme Willy, Nick Frost, Clive Gollings, Seth Rogen, Paul (voice), Jason Bateman, Special Agent Lorenzo Zoil, Kristen Wiig, Ruth Buggs, Bill Hader, Haggard, Blythe Danner, Tara Walton, Joe Lo Truglio, O'Reilly, John Carroll Lynch, Moses Buggs","Adventure, Comedy, Science Fiction",6.708
Inside Man,2006-03-17,45000000,"Denzel Washington, Detective Keith Frazier, Clive Owen, Dalton Russell, Jodie Foster, Madeleine White, Christopher Plummer, Arthur Case, Willem Dafoe, Captain John Darius, Chiwetel Ejiofor, Detective Bill Mitchell, Carlos Andrés Gómez, Steve, Kim Director, Stevie, James Ransone, Steve-O","Crime, Drama, Thriller",7.399
Bright,2017-12-22,90000000,"Will Smith, Daryl Ward, Joel Edgerton, Nick Jakoby, Lucy Fry, Tikka, Noomi Rapace, Leilah, Edgar Ramírez, Kandomere, Ike Barinholtz, Pollard, Veronica Ngo, Tien, Alex Meraz, Serafin, Happy Anderson, Montehugh","Fantasy, Action, Thriller",6.156
The Invisible Man,2020-02-26,7000000,"Elisabeth Moss, Cecilia Kass, Aldis Hodge, James Lanier, Storm Reid, Sydney Lanier, Michael Dorman, Tom Griffin, Harriet Dyer, Emily Kass, Oliver Jackson-Cohen, Adrian Griffin, Benedict Hardie, Marc, Zara Michales, Nurse, Renee Lim, Doctor Lee","Thriller, Science Fiction, Horror",7.129
Monty Python and the Holy Grail,1975-05-25,400000,"Graham Chapman, King Arthur / Voice of God / Middle Head / Hiccoughing Guard, John Cleese, Second Swallow-Savvy Guard / The Black Knight / Peasant 3 / Sir Launcelot the Brave / Taunting French Guard / Tim the Enchanter, Eric Idle, Dead Collector / Peasant 1 / Sir Robin the Not-Quite-So-Brave-as-Sir Launcelot / First Swamp Castle Guard / Concorde / Roger the Shrubber / Brother Maynard, Terry Gilliam, Patsy / Green Knight / Old Man from Scene 24 (Bridgekeeper) / Sir Bors / Animator / Gorilla Hand, Terry Jones, Dennis's Mother / Sir Bedevere / Left Head / Prince Herbert / Voice of Cartoon Scribe, Michael Palin, First Swallow-Savvy Guard / Dennis / Peasant 2 / Right Head / Sir Galahad the Pure / Narrator / King of Swamp Castle / Brother Maynard's Brother / Leader of The Knights Who Say NI!, Connie Booth, The Witch, Carol Cleveland, Zoot / Dingo, Neil Innes, First Monk / Singing Minstrel / Page Crushed by the Rabbit / Peasant #4","Adventure, Comedy, Fantasy",7.797
Die Hard 2,1990-07-03,70000000,"Bruce Willis, John McClane, Bonnie Bedelia, Holly McClane, William Sadler, Stuart, Art Evans, Leslie Barnes, Dennis Franz, Capt. Carmine Lorenzo, William Atherton, Richard Thornburg, John Amos, Major Grant, Fred Dalton Thompson, Trudeau, Tom Bower, Marvin","Action, Thriller",6.923
Just Go with It,2011-02-10,80000000,"Adam Sandler, Danny Maccabee, Jennifer Aniston, Katherine Murphy, Nicole Kidman, Devlin Adams, Nick Swardson, Eddie Simms, Brooklyn Decker, Palmer Dodge, Bailee Madison, Maggie Murphy, Vanessa Villalovos, Saleswoman, Kevin Nealon, Adon, Griffin Gluck, Michael Murphy","Comedy, Romance",6.673
Cars 3,2017-06-15,175000000,"Owen Wilson, Lightning McQueen (voice), Cristela Alonzo, Cruz Ramirez (voice), Chris Cooper, Smokey Yunick (voice), Nathan Fillion, Sterling (voice), Armie Hammer, Jackson Storm (voice), Larry the Cable Guy, Mater (voice), Bonnie Hunt, Sally Carrera (voice), Lea DeLaria, Miss Fritter (voice), Kerry Washington, Natalie Certain (voice)","Animation, Adventure, Comedy, Family",6.853
Annabelle: Creation,2017-08-03,15000000,"Stephanie Sigman, Sister Charlotte, Talitha Bateman, Janice, Lulu Wilson, Linda, Anthony LaPaglia, Samuel Mullins, Miranda Otto, Esther Mullins, Grace Caroline Currey, Carol, Philippa Coulthard, Nancy, Samara Lee, Annabelle ""Bee"" Mullins, Tayler Buck, Kate","Horror, Mystery, Thriller",6.6
The Goonies,1985-06-07,19000000,"Sean Astin, Mikey Walsh, Josh Brolin, Brand Walsh, Jeff Cohen, Lawrence ""Chunk"" Cohen, Corey Feldman, Clark ""Mouth"" Devereaux, Kerri Green, Andy Carmichael, Martha Plimpton, Stephanie ""Stef"" Steinbrenner, Ke Huy Quan, Richard ""Data"" Wang, John Matuszak, Sloth, Robert Davi, Jake Fratelli","Adventure, Comedy, Family",7.52
Five Feet Apart,2019-03-14,7000000,"Haley Lu Richardson, Stella Grant, Cole Sprouse, Will Newman, Moisés Arias, Poe Ramírez, Kimberly Hebert Gregory, Nurse Barb, Parminder Nagra, Dr. Noor Hamid, Claire Forlani, Meredith, Emily Baldoni, Julie, Gary Weeks, Tom, Rebecca Chulew, Doctor","Romance, Drama",8.287
Vertigo,1958-05-28,2479000,"James Stewart, Det. John 'Scottie' Ferguson, Kim Novak, Madeleine Elster / Judy Barton, Barbara Bel Geddes, Marjorie 'Midge' Wood, Tom Helmore, Gavin Elster, Henry Jones, Coroner, Raymond Bailey, Scottie's Doctor, Ellen Corby, Manager of McKittrick Hotel, Konstantin Shayne, Pop Leibel, Lee Patrick, Car Owner Mistaken for Madeleine","Mystery, Romance, Thriller",8.18
Total Recall,1990-06-01,65000000,"Colin Farrell, Douglas Quaid / Hauser, Kate Beckinsale, Lori Quaid, Jessica Biel, Melina, Bryan Cranston, Cohaagen, Bokeem Woodbine, Harry, Bill Nighy, Matthias, John Cho, McClane, Will Yun Lee, Marek, Milton Barnes, Resistance Fighter","Action, Science Fiction, Thriller",7.284
Casino,1995-11-22,50000000,"Robert De Niro, Sam 'Ace' Rothstein, Sharon Stone, Ginger McKenna, Joe Pesci, Nicky Santoro, Don Rickles, Billy Sherbert, James Woods, Lester Diamond, Alan King, Andy Stone, Kevin Pollak, Phillip Green, Pasquale Cajano, Remo Gaggi, L.Q. Jones, Pat Webb","Crime, Drama",8.004
Moon,2009-06-12,5000000,"Sam Rockwell, Sam Bell, Kevin Spacey, GERTY (voice), Dominique McElligott, Tess Bell, Rosie Shaw, Little Eve, Adrienne Shaw, Nanny, Kaya Scodelario, Eve, Benedict Wong, Thompson, Matt Berry, Overmeyers, Malcolm Stewart, Technician","Science Fiction, Drama",7.57
Bambi,1942-08-14,858000,"Donnie Dunagan, Young Bambi (voice) (uncredited), Peter Behn, Young Thumper (voice) (uncredited), Stan Alexander, Young Flower (voice) (uncredited), Cammie King, Young Faline (voice) (uncredited), Will Wright, Friend Owl (voice) (uncredited), Hardie Albright, Adolescent Bambi (voice) (uncredited), Ann Gillis, Adolescent Faline (voice) (uncredited), Tim Davis, Adolescent Thumper / Adolescent Flower (voice) (uncredited), Sam Edwards, Adult Thumper (voice) (uncredited)","Animation, Drama, Family",7.0
Jurassic World Dominion,2022-06-01,165000000,"Chris Pratt, Owen Grady, Bryce Dallas Howard, Claire Dearing, Laura Dern, Dr. Ellie Sattler, Jeff Goldblum, Dr. Ian Malcolm, Sam Neill, Dr. Alan Grant, DeWanda Wise, Kayla Watts, Mamoudou Athie, Ramsay Cole, Isabella Sermon, Maisie Lockwood, Campbell Scott, Lewis Dodgson","Adventure, Action, Science Fiction",6.787
John Carter,2012-03-07,250000000,"Taylor Kitsch, John Carter, Lynn Collins, Dejah Thoris, Samantha Morton, Sola, Willem Dafoe, Tars Tarkas, Thomas Haden Church, Tal Hajus, Mark Strong, Matai Shang, Ciarán Hinds, Tardos Mors, Dominic West, Sab Than, James Purefoy, Kantos Kan","Action, Adventure, Science Fiction",6.296
G.I. Joe: Retaliation,2013-03-27,130000000,"Dwayne Johnson, Marvin Hinton / Roadblock, Bruce Willis, Joe Colton, Jonathan Pryce, U.S. President, Adrianne Palicki, Jaye Burnett / Lady Jaye, Ray Park, Snake Eyes, Ray Stevenson, Firefly, Élodie Yung, Kim Arashikage / Jinx, Lee Byung-hun, Tommy Arashikage / Storm Shadow, D.J. Cotrona, Dashiell Faireborn / Flint","Science Fiction, Adventure, Action, Thriller",5.609
Who Framed Roger Rabbit,1988-06-21,70000000,"Bob Hoskins, Eddie Valiant, Christopher Lloyd, Judge Doom, Joanna Cassidy, Dolores, Charles Fleischer, Roger Rabbit / Benny The Cab / Greasy / Psycho (voice), Stubby Kaye, Marvin Acme, Alan Tilvern, R.K. Maroon, Richard LeParmentier, Lt. Santino, Lou Hirsch, Baby Herman (voice), Betsy Brantley, Jessica's Performance Model","Fantasy, Animation, Comedy, Crime",7.52
Everything Everywhere All at Once,2022-03-24,25000000,"Michelle Yeoh, Evelyn Wang, Stephanie Hsu, Joy Wang / Jobu Tupaki, Ke Huy Quan, Waymond Wang, James Hong, Gong Gong, Jamie Lee Curtis, Deirdre Beaubeirdre, Tallie Medel, Becky Sregor, Jenny Slate, Debbie the Dog Mom, Harry Shum Jr., Chad, Biff Wiff, Rick","Action, Adventure, Science Fiction",7.822
Black Hawk Down,2001-12-28,92000000,"Josh Hartnett, SSgt. Matt Eversmann, Ewan McGregor, Spec. John Grimes, Eric Bana, Sfc. Norm 'Hoot' Hooten, Jason Isaacs, Capt. Mike Steele, William Fichtner, Sfc. Jeff Sanderson, Tom Sizemore, Lt. Col. Danny McKnight, Ewen Bremner, Spec. Shawn Nelson, Sam Shepard, Maj. Gen. William F. Garrison, Orlando Bloom, Todd Blackburn","Action, History, War",7.368
Jungle Cruise,2021-07-28,200000000,"Dwayne Johnson, Frank Wolff, Emily Blunt, Dr. Lily Houghton, Edgar Ramírez, Lope de Aguirre, Jack Whitehall, McGregor Houghton, Jesse Plemons, Prince Joachim, Paul Giamatti, Nilo, Veronica Falcón, Trader Sam, Dani Rovira, Sancho, Quim Gutiérrez, Melchor","Action, Adventure, Fantasy",7.418
The Chronicles of Narnia: The Voyage of the Dawn Treader,2010-12-02,155000000,"Ben Barnes, Caspian, Skandar Keynes, Edmund Prevensie, Georgie Henley, Lucy Pevensie, Will Poulter, Eustace Scrubb, Anna Popplewell, Susan Pevensie, William Moseley, Peter Pevensie, Simon Pegg, Reepicheep (Voice), Liam Neeson, Aslan (voice), Tilda Swinton, The White Witch","Adventure, Family, Fantasy",6.433
The Hurt Locker,2008-10-10,15000000,"Jeremy Renner, Staff Sergeant William James, Anthony Mackie, Sergeant JT Sanborn, Brian Geraghty, Specialist Owen Eldridge, David Morse, Colonel Reed, Guy Pearce, Sergeant Matt Thompson, Evangeline Lilly, Connie James, Ralph Fiennes, Contractor Team Leader, Christian Camargo, Colonel John Cambridge, Christopher Sayegh, Beckham","Drama, Thriller, War",7.254
Zombieland: Double Tap,2019-10-09,42000000,"Woody Harrelson, Tallahassee, Jesse Eisenberg, Columbus, Emma Stone, Wichita, Abigail Breslin, Little Rock, Rosario Dawson, Nevada, Zoey Deutch, Madison, Luke Wilson, Albuquerque, Avan Jogia, Berkeley, Thomas Middleditch, Flagstaff","Comedy, Horror",6.955
The Untouchables,1987-06-03,25000000,"Kevin Costner, Eliot Ness, Sean Connery, Jim Malone, Charles Martin Smith, Oscar Wallace, Andy García, George Stone, Robert De Niro, Al Capone, Richard Bradford, Mike, Jack Kehoe, Payne, Brad Sullivan, George, Billy Drago, Nitti","Crime, Drama, History, Thriller",7.77
Southpaw,2015-03-24,30000000,"Jake Gyllenhaal, Billy 'The Great'  Hope, Rachel McAdams, Maureen Hope, Forest Whitaker, Titus 'Tick' Wills, Oona Laurence, Leila Hope, 50 Cent, Jordan Mains, Skylan Brooks, Hoppy, Naomie Harris, Angela Rivera, Victor Ortiz, Ramone, Beau Knapp, Jon Jon","Action, Drama",7.362
School of Rock,2003-10-03,35000000,"Jack Black, Dewey Finn, Joan Cusack, Rosalie Mullins, Mike White, Ned Schneebly, Sarah Silverman, Patty Di Marco, Lee Wilkof, Mr. Green, Kate McGregor-Stewart, Mrs. Lemmons, Adam Pascal, Theo, Suzzanne Douglas, Tomika's Mother, Miranda Cosgrove, Summer Hathaway","Comedy, Music, Family",7.071
Liar Liar,1997-03-21,45000000,"Jim Carrey, Fletcher Reede, Maura Tierney, Audrey Reede, Justin Cooper, Max Reede, Cary Elwes, Jerry, Anne Haney, Greta, Jennifer Tilly, Samantha Cole, Amanda Donohoe, Miranda, Jason Bernard, Judge Marshall Stevens, Swoosie Kurtz, Dana Appleton",Comedy,6.667
Signs,2002-08-02,72000000,"Mel Gibson, Graham Hess, Joaquin Phoenix, Merrill Hess, Rory Culkin, Morgan Hess, Abigail Breslin, Bo Hess, Cherry Jones, Officer Paski, M. Night Shyamalan, Ray Reddy, Patricia Kalember, Colleen Hess, Ted Sutton, SFC Cunningham, Merritt Wever, Tracey Abernathy","Drama, Thriller, Science Fiction, Mystery",6.681
The Good Dinosaur,2015-11-14,175000000,"Frances McDormand, Momma (voice), Raymond Ochoa, Arlo (voice), Jeffrey Wright, Poppa (voice), Steve Zahn, Thunderclap (voice), Sam Elliott, Butch (voice), Anna Paquin, Ramsey (voice), John Ratzenberger, Earl (voice), A.J. Buckley, Nash (voice), Marcus Scribner, Buck (voice)","Adventure, Animation, Family",6.745
Red Notice,2021-11-04,160000000,"Dwayne Johnson, John Hartley, Ryan Reynolds, Nolan Booth, Gal Gadot, Sarah Black / The Bishop, Ritu Arya, Inspector Urvashi Das, Chris Diamantopoulos, Sotto Voce, Ivan Mbakop, Tambwe, Vincenzo Amato, Director Gallo, Rafael Petardi, Security Chief Ricci, Seth Michaels, Souvenir Stand Owner","Action, Comedy, Crime, Thriller",6.803
Battleship,2012-04-11,209000000,"Taylor Kitsch, Lieutenant Alex Hopper, Tadanobu Asano, Captain Yugi Nagata, Rihanna, Petty Officer Cora 'Weps' Raikes, Brooklyn Decker, Sam, Gregory D. Gadson, Lieutenant Colonel Mick Canales, Hamish Linklater, Cal Zapata, Liam Neeson, Admiral Shane, Alexander Skarsgård, Commander Stone Hopper, Jerry Ferrara, Sampson JOOD Strodell","Thriller, Action, Adventure, Science Fiction",5.808
RoboCop,2014-01-30,120000000,"Peter Weller, Officer Alex J. Murphy / RoboCop, Nancy Allen, Officer Anne Lewis, Dan O'Herlihy, The Old Man, Ronny Cox, Dick Jones, Kurtwood Smith, Clarence Boddicker, Miguel Ferrer, Bob Morton, Robert DoQui, Sgt. Warren Reed, Ray Wise, Leon Nash, Felton Perry, Johnson","Action, Thriller, Science Fiction",5.847
Collateral Beauty,2016-12-15,36000000,"Will Smith, Howard Inlet, Edward Norton, Whit Yardsham, Kate Winslet, Claire Wilson, Michael Peña, Simon Scott, Helen Mirren, Brigitte, Jacob Latimore, Raffi, Keira Knightley, Amy Moore, Naomie Harris, Madeleine, Ann Dowd, Sally Price","Drama, Romance",7.239
The Italian Job,2003-05-30,60000000,"Mark Wahlberg, Charlie Croker, Charlize Theron, Stella Bridger, Edward Norton, Steve, Jason Statham, Handsome Rob, Seth Green, Lyle, Yasiin Bey, Left Ear, Donald Sutherland, John Bridger, Boris Lee Krutonog, Yevhen, Franky G, Wrench","Action, Crime",6.763
The Wizard of Oz,1939-08-15,2777000,"Judy Garland, Dorothy Gale, Ray Bolger, Hunk / Scarecrow, Jack Haley, Hickory / Tin Man, Bert Lahr, Zeke / Cowardly Lion, Margaret Hamilton, Miss Gulch / Wicked Witch of the West, Frank Morgan, Professor Marvel / The Wizard of Oz, Clara Blandick, Auntie Em, Charley Grapewin, Uncle Henry, Billie Burke, Glinda the Good Witch of the North","Adventure, Fantasy, Family",7.571
Dr. Strangelove or: How I Learned to Stop Worrying and Love the Bomb,1964-01-29,1800000,"Peter Sellers, Group Capt. Lionel Mandrake / President Merkin Muffley / Dr. Strangelove, George C. Scott, General ""Buck"" Turgidson, Sterling Hayden, Brigadier General Jack D. Ripper, Keenan Wynn, Colonel Bat Guano, Slim Pickens, Major ""King"" Kong, Peter Bull, Botschafter De Sadesky, James Earl Jones, Lt. Lothar Zogg, Tracy Reed, Miss Scott, Jack Creley, Mr. Staines","Drama, Comedy, War",8.129
Salt,2010-07-21,110000000,"Angelina Jolie, Evelyn Salt, Liev Schreiber, Theodore Winter, Chiwetel Ejiofor, Darryl Peabody, Daniel Olbrychski, Oleg Vasilyevich Orlov, August Diehl, Mike Krause, Daniel Pearce, Young Orlov, Hunt Block, US President Howard Lewis, Andre Braugher, Secretary of Defense, Olek Krupa, Russian President Matveyev","Action, Mystery, Thriller",6.398
