2012,2009-10-10,200000000,"John Cusack, Jackson Curtis, Chiwetel Ejiofor, Adrian Helmsley, Amanda Peet, Kate Curtis, Oliver Platt, Carl Anheuser, Thandiwe Newton, Laura Wilson, Tom McCarthy, Gordon Silberman, George Segal, Tony Delgatto, Danny Glover, President Thomas Wilson, Woody Harrelson, Charlie Frost","Action, Adventure, Science Fiction",5.819
The Godfather Part II,1974-12-20,13000000,"Al Pacino, Don Michael Corleone, Robert Duvall, Tom Hagen, Diane Keaton, Kay Corleone, Robert De Niro, Don Vito Corleone, John Cazale, Frederico 'Fredo' Corleone, Talia Shire, Constanzia 'Connie' Corleone, Lee Strasberg, Hyman Roth, Michael V. Gazzo, Frank Pentangeli, G. D. Spradlin, Senator Pat Geary","Drama, Crime",8.591
American Beauty,1999-09-15,15000000,"Kevin Spacey, Lester Burnham, Annette Bening, Carolyn Burnham, Thora Birch, Jane Burnham, Wes Bentley, Ricky Fitts, Mena Suvari, Angela Hayes, Chris Cooper, Colonel Frank Fitts, Allison Janney, Barbara Fitts, Peter Gallagher, Buddy Kane, Scott Bakula, Jim Olmeyer",Drama,8.0
Prometheus,2012-05-30,130000000,"Noomi Rapace, Dr. Elizabeth Shaw, Michael Fassbender, David, Logan Marshall-Green, Charlie Holloway, Charlize Theron, Meredith Vickers, Idris Elba, Janek, Guy Pearce, Peter Weyland, Sean Harris, Fifield, Rafe Spall, Millburn, Kate Dickie, Ford","Science Fiction, Adventure, Mystery",6.535
The Social Network,2010-10-01,40000000,"Jesse Eisenberg, Mark Zuckerberg, Andrew Garfield, Eduardo Saverin, Justin Timberlake, Sean Parker, Armie Hammer, Cameron Winklevoss / Tyler Winklevoss, Max Minghella, Divya Narendra, Rooney Mara, Erica Albright, Brenda Song, Christy Lee, Rashida Jones, Marylin Delpy, John Getz, Sy",Drama,7.358
Pirates of the Caribbean: Dead Men Tell No Tales,2017-05-23,230000000,"Johnny Depp, Jack Sparrow, Javier Bardem, Armando Salazar, Geoffrey Rush, Hector Barbossa, Brenton Thwaites, Henry Turner, Kaya Scodelario, Carina Smyth, Kevin McNally, Joshamee Gibbs, Golshifteh Farahani, Shansa, David Wenham, Scarfield, Stephen Graham, Scrum","Adventure, Action, Fantasy",6.648
Knives Out,2019-11-27,40000000,"Daniel Craig, Benoit Blanc, Chris Evans, Ransom Drysdale, Ana de Armas, Marta Cabrera, Jamie Lee Curtis, Linda Drysdale, Michael Shannon, Walt Thrombey, Don Johnson, Richard Drysdale, Toni Collette, Joni Thrombey, Lakeith Stanfield, Lieutenant Elliott, Christopher Plummer, Harlan Thrombey","Comedy, Crime, Mystery",7.847
Good Will Hunting,1997-12-05,10000000,"Matt Damon, Will Hunting, Robin Williams, Sean Maguire, Ben Affleck, Chuckie Sullivan, Stellan Skarsgård, Gerald Lambeau, Minnie Driver, Skylar, Casey Affleck, Morgan O'Mally, Cole Hauser, Billy McBride, Vik Sahay, MIT Student, John Mighton, Tom",Drama,8.149
Fifty Shades of Grey,2015-02-11,40000000,"Dakota Johnson, Anastasia Steele, Jamie Dornan, Christian Grey, Jennifer Ehle, Carla Wilks, Eloise Mumford, Kate Kavanagh, Victor Rasuk, Jose Rodriguez, Luke Grimes, Elliot Grey, Marcia Gay Harden, Dr. Grace Trevelyan-Grey, Rita Ora, Mia Grey, Max Martini, Jason Taylor","Drama, Romance, Thriller",5.882
The Devil Wears Prada,2006-06-29,35000000,"Anne Hathaway, Andy Sachs, Meryl Streep, Miranda Priestly, Emily Blunt, Emily, Stanley Tucci, Nigel, Simon Baker, Christian Thompson, Adrian Grenier, Nate, Tracie Thoms, Lily, Rich Sommer, Doug, Daniel Sunjata, James Holt","Comedy, Drama, Romance",7.384
Taxi Driver,1976-02-09,1900000,"Robert De Niro, Travis Bickle, Jodie Foster, Iris Steensma, Albert Brooks, Tom, Harvey Keitel, Sport Higgins, Leonard Harris, Senator Charles Palantine, Peter Boyle, Wizard, Cybill Shepherd, Betsy, Diahnne Abbott, Concession Girl, Frank Adu, Angry Black Man","Crime, Drama",8.2
A Star Is Born,2018-10-03,36000000,"Bradley Cooper, Jackson Maine, Lady Gaga, Ally Campana, Sam Elliott, Bobby Maine, Andrew Dice Clay, Lorenzo Campana, Rafi Gavron, Rez Gavron, Anthony Ramos, Ramon, Dave Chappelle, George ""Noodles"" Stone, Marlon Williams, Himself, Brandi Carlile, Herself","Music, Drama, Romance",7.503
Fury,2014-10-15,68000000,"Brad Pitt, Don 'Wardaddy' Collier, Logan Lerman, Norman Ellison, Michael Peña, Trini 'Gordo' Garcia, Shia LaBeouf, Boyd 'Bible' Swan, Jon Bernthal, Grady 'Coon-Ass' Travis, Jim Parrack, Sergeant Binkowski, Brad William Henke, Sergeant Davis, Anamaria Marinca, Irma, Alicia von Rittberg, Emma","War, Drama, Action",7.518
The Incredible Hulk,2008-06-12,150000000,"Edward Norton, Bruce Banner / The Hulk, Liv Tyler, Betty Ross, Tim Roth, Emil Blonsky / Abomination, William Hurt, Thaddeus 'Thunderbolt' Ross, Tim Blake Nelson, Samuel Sterns, Ty Burrell, Leonard Samson, Christina Cabot, Kathleen Sparr, Peter Mensah, General Joe Greller, Lou Ferrigno, Incredible Hulk (voice) / Security Guard","Science Fiction, Action, Adventure",6.204
Kick-Ass,2010-03-22,28000000,"Aaron Taylor-Johnson, Dave Lizewski / Kick-Ass, Chloë Grace Moretz, Mindy Macready / Hit-Girl, Nicolas Cage, Damon Macready / Big Daddy, Lyndsy Fonseca, Katie Deauxma, Mark Strong, Frank D'Amico, Deborah Twiss, Mrs. Zane, Christopher Mintz-Plasse, Chris D'Amico / Red Mist, Elizabeth McGovern, Mrs. Lizewski, Omari Hardwick, Marcus","Action, Crime",7.12
"I, Robot",2004-07-15,120000000,"Will Smith, Del Spooner, Bridget Moynahan, Susan Calvin, Alan Tudyk, Sonny (voice), James Cromwell, Dr. Alfred Lanning, Bruce Greenwood, Lawrence Robertson, Shia LaBeouf, Farber, Chi McBride, Lt. John Bergin, Jerry Wasserman, Baldez, Peter Shinkoda, Chin","Action, Science Fiction",6.939
No Country for Old Men,2007-06-13,25000000,"Josh Brolin, Llewelyn Moss, Javier Bardem, Anton Chigurh, Tommy Lee Jones, Ed Tom Bell, Kelly Macdonald, Carla Jean Moss, Woody Harrelson, Carson Wells, Garret Dillahunt, Wendell, Tess Harper, Loretta Bell, Barry Corbin, Ellis, Stephen Root, Man who hires Wells","Crime, Drama, Thriller",7.933
Rise of the Planet of the Apes,2011-08-03,93000000,"James Franco, Will Rodman, Andy Serkis, Caesar, Freida Pinto, Caroline Aranha, John Lithgow, Charles Rodman, Brian Cox, John Landon, Tom Felton, Dodge Landon, David Hewlett, Douglas Hunsiker, Tyler Labine, Robert Franklin, David Oyelowo, Steven Jacobs","Thriller, Action, Drama, Science Fiction",7.289
Ocean's Eleven,2001-12-07,85000000,"George Clooney, Danny Ocean, Matt Damon, Linus Caldwell, Andy García, Terry Benedict, Brad Pitt, Rusty Ryan, Julia Roberts, Tess Ocean, Casey Affleck, Virgil Malloy, Scott Caan, Turk Malloy, Elliott Gould, Reuben Tishkoff, Eddie Jemison, Livingston Dell","Thriller, Crime",7.43
The Sixth Sense,1999-08-06,40000000,"Bruce Willis, Malcolm Crowe, Haley Joel Osment, Cole Sear, Toni Collette, Lynn Sear, Olivia Williams, Anna Crowe, Donnie Wahlberg, Vincent Grey, Mischa Barton, Kyra Collins, Trevor Morgan, Tommy Tammisimo, Glenn Fitzgerald, Sean, Bruce Norris, Stanley Cunningham","Mystery, Thriller, Drama",7.944
Amélie,2001-04-25,10000000,"Audrey Tautou, Amélie Poulain, Mathieu Kassovitz, Nino Quincampoix, Rufus, Raphaël Poulain, Lorella Cravotta, Amandine Poulain, Serge Merlin, Raymond Dufayel, Jamel Debbouze, Lucien, Clotilde Mollet, Gina, Claire Maurier, Suzanne, Isabelle Nanty, Georgette","Comedy, Romance",7.905
Scarface,1983-12-09,25000000,"Al Pacino, Tony Montana, Steven Bauer, Manny Ribera, Michelle Pfeiffer, Elvira, Mary Elizabeth Mastrantonio, Gina, Robert Loggia, Frank Lopez, Miriam Colon, Mama Montana, F. Murray Abraham, Omar, Paul Shenar, Alejandro Sosa, Harris Yulin, Bernstein","Action, Crime, Drama",8.168
Prisoners,2013-09-19,46000000,"Hugh Jackman, Keller Dover, Jake Gyllenhaal, Detective Loki, Maria Bello, Grace Dover, Terrence Howard, Franklin Birch, Paul Dano, Alex Jones, Viola Davis, Nancy Birch, Melissa Leo, Holly Jones, Dylan Minnette, Ralph Dover, Zoë Soul, Eliza Birch","Drama, Thriller, Crime",8.091
American History X,1998-07-01,20000000,"Edward Norton, Derek, Edward Furlong, Danny, Beverly D'Angelo, Doris, Jennifer Lien, Davina, Ethan Suplee, Seth, Fairuza Balk, Stacey, Avery Brooks, Sweeney, Elliott Gould, Murray, Stacy Keach, Cameron",Drama,8.352
The Conjuring,2013-07-18,13000000,"Patrick Wilson, Ed Warren, Vera Farmiga, Lorraine Warren, Lili Taylor, Carolyn Perron, Ron Livingston, Roger Perron, Mackenzie Foy, Cindy Perron, Joey King, Christine Perron, Shannon Kook, Drew Thomas, John Brotherton, Brad Hamilton, Hayley McFarland, Nancy Perron","Horror, Thriller",7.541
The Fault in Our Stars,2014-05-16,14000000,"Shailene Woodley, Hazel Grace Lancaster, Ansel Elgort, Augustus Waters, Nat Wolff, Isaac, Laura Dern, Frannie Lancaster, Sam Trammell, Michael Lancaster, Willem Dafoe, Peter van Houten, Lotte Verbeek, Lidewij Vliegenthart, Mike Birbiglia, Patrick, Ana Dela Cruz, Dr. Maria","Romance, Drama",7.598
The Notebook,2004-06-25,29000000,"Rachel McAdams, Allison ""Allie"" Hamilton, Ryan Gosling, Noah ""Duke"" Calhoun, Gena Rowlands, Old Allison ""Allie"" Hamilton, James Garner, Old Noah ""Duke"" Calhoun, Sam Shepard, Frank Calhoun, Joan Allen, Anne Hamilton, James Marsden, Lon Hammond Jr., David Thornton, John Hamilton, Kevin Connolly, Fin","Romance, Drama",7.88
12 Years a Slave,2013-10-18,20000000,"Chiwetel Ejiofor, Solomon Northup, Michael Fassbender, Edwin Epps, Lupita Nyong'o, Patsey, Benedict Cumberbatch, William Ford, Paul Dano, John Tibeats, Sarah Paulson, Mary Epps, Adepero Oduye, Eliza, Scoot McNairy, Brown, Paul Giamatti, Theophilus Freeman","Drama, History",7.945
2001: A Space Odyssey,1968-04-02,12000000,"Keir Dullea, Dr. David Bowman, Gary Lockwood, Dr. Frank Poole, William Sylvester, Dr. Heywood Floyd, Douglas Rain, HAL 9000 (voice), Daniel Richter, Moonwatcher, Leonard Rossiter, Dr. Andrei Smyslov, Margaret Tyzack, Elena, Robert Beatty, Dr. Ralph Halvorsen, Sean Sullivan, Dr. Roy Michaels","Science Fiction, Mystery, Adventure",8.076
In Time,2011-10-27,40000000,"Justin Timberlake, Will Salas, Amanda Seyfried, Sylvia Weis, Cillian Murphy, Raymond Leon, Olivia Wilde, Rachel Salas, Alex Pettyfer, Fortis, Johnny Galecki, Borel, Matt Bomer, Henry Hamilton, Vincent Kartheiser, Philippe Weis, Yaya DaCosta, Greta","Action, Thriller, Science Fiction",6.953
Aladdin,1992-11-25,28000000,"Will Smith, Genie / Mariner, Mena Massoud, Aladdin, Naomi Scott, Jasmine, Marwan Kenzari, Jafar, Navid Negahban, Sultan, Nasim Pedrad, Dalia, Billy Magnussen, Prince Anders, Numan Acar, Hakim, Jordan A. Nash, Omar","Adventure, Fantasy, Romance, Family",7.645
Green Book,2018-11-16,23000000,"Viggo Mortensen, Tony Lip, Mahershala Ali, Dr. Don Shirley, Linda Cardellini, Dolores, Sebastian Maniscalco, Johnny Venere, Dimiter D. Marinov, Oleg, Mike Hatton, George, P.J. Byrne, Record Exec, Joe Cortese, Gio Loscudo, Maggie Nixon, Copa Coat Check Girl","Drama, Comedy",8.242
Tangled,2010-11-24,260000000,"Mandy Moore, Rapunzel (voice), Zachary Levi, Flynn Rider (voice), Donna Murphy, Mother Gothel (voice), Ron Perlman, Stabbington Brother (voice), M.C. Gainey, Captain of the Guard (voice), Jeffrey Tambor, Big Nose Thug (voice), Brad Garrett, Hook Hand Thug (voice), Paul F. Tompkins, Short Thug (voice), Richard Kiel, Vlad (voice)","Animation, Family",7.599
Cast Away,2000-12-22,90000000,"Tom Hanks, Chuck Noland, Helen Hunt, Kelly Frears, Chris Noth, Jerry Lovett, Paul Sanchez, Ramon, Lari White, Bettina Peterson, Leonid Citer, Fyodor, David Allen Brooks, Dick Peterson, Semion Sudarikov, Nicolai, Peter Von Berg, Yuri","Adventure, Drama",7.662
Despicable Me 2,2013-06-26,76000000,"Steve Carell, Gru (voice), Kristen Wiig, Lucy (voice), Benjamin Bratt, Eduardo 'El Macho' Pérez (voice), Miranda Cosgrove, Margo (voice), Russell Brand, Dr. Nefario (voice), Ken Jeong, Floyd Eagle-san (voice), Steve Coogan, Silas Ramsbottom (voice), Elsie Fisher, Agnes (voice), Dana Gaier, Edith (voice)","Animation, Comedy, Family",6.916
Kung Fu Panda,2008-06-04,130000000,"Jack Black, Po (voice), Dustin Hoffman, Shifu (voice), Angelina Jolie, Master Tigress (voice), Jackie Chan, Master Monkey (voice), Lucy Liu, Master Viper (voice), Seth Rogen, Mantis (voice), David Cross, Crane (voice), Ian McShane, Tai Lung (voice), Randall Duk Kim, Oogway (voice)","Action, Adventure, Animation, Family, Comedy",7.24
Transformers,2007-06-27,150000000,"Shia LaBeouf, Sam Witwicky, Megan Fox, Mikaela Banes, Josh Duhamel, Captain Lennox, Tyrese Gibson, USAF Tech Sergeant Epps, Rachael Taylor, Maggie Madsen, Anthony Anderson, Glen Whitman, Jon Voight, Defense Secretary John Keller, John Turturro, Agent Simmons, Michael O'Neill, Tom Banacheck","Adventure, Science Fiction, Action",6.8
E.T. the Extra-Terrestrial,1982-06-11,10500000,"Henry Thomas, Elliott, Drew Barrymore, Gertie, Robert MacNaughton, Michael, Peter Coyote, Keys, Dee Wallace, Mary, Erika Eleniak, Pretty Girl, K.C. Martel, Greg, C. Thomas Howell, Tyler, Sean Frye, Steve","Science Fiction, Adventure, Family, Fantasy",7.512
Taken,2008-02-18,25000000,"Liam Neeson, Bryan Mills, Maggie Grace, Kim Mills, Leland Orser, Sam Gilroy, Famke Janssen, Lenore St John, Jon Gries, Mark Casey, David Warshofsky, Bernie Harris, Holly Valance, Sheerah, Katie Cassidy, Amanda, Xander Berkeley, Stuart  St John","Action, Thriller",7.387
Jurassic World: Fallen Kingdom,2018-06-22,170000000,"Chris Pratt, Owen Grady, Bryce Dallas Howard, Claire Dearing, Rafe Spall, Eli Mills, Toby Jones, Mr. Eversoll, Ted Levine, Ken Wheatley, BD Wong, Dr. Henry Wu, Jeff Goldblum, Dr. Ian Malcolm, Justice Smith, Franklin Webb, Daniella Pineda, Zia Rodriguez","Action, Adventure, Science Fiction, Thriller",6.548
The Big Lebowski,1998-03-06,15000000,"Jeff Bridges, Jeffrey 'The Dude' Lebowski, John Goodman, Walter Sobchak, Steve Buscemi, Theodore Donald 'Donny' Kerabatsos, Julianne Moore, Maude Lebowski, David Huddleston, Jeffrey 'The Big' Lebowski, Philip Seymour Hoffman, Brandt, John Turturro, Jesus Quintana, Sam Elliott, The Stranger, Peter Stormare, Nihilist #1, Uli Kunkel / ""Karl Hungus""","Comedy, Crime",7.842
Dawn of the Planet of the Apes,2014-06-26,170000000,"Andy Serkis, Caesar, Jason Clarke, Malcolm, Gary Oldman, Dreyfus, Keri Russell, Ellie, Toby Kebbell, Koba, Kodi Smit-McPhee, Alexander, Kirk Acevedo, Carver, Nick Thurston, Blue Eyes, Terry Notary, Rocket","Science Fiction, Action, Drama, Thriller",7.306
Dead Poets Society,1989-06-02,16400000,"Robin Williams, John Keating, Ethan Hawke, Todd Anderson, Robert Sean Leonard, Neil Perry, Gale Hansen, Charlie Dalton, Josh Charles, Knox Overstreet, Dylan Kussman, Richard Cameron, Allelon Ruggiero, Steven Meeks, James Waterston, Gerard Pitts, Norman Lloyd, Mr. Nolan",Drama,8.312
Your Name.,2016-08-26,0,"Ryunosuke Kamiki, Taki Tachibana (voice), Mone Kamishiraishi, Mitsuha Miyamizu (voice), Ryo Narita, Katsuhiko Teshigawara (voice), Aoi Yuki, Sayaka Natori (voice), Nobunaga Shimazaki, Tsukasa Fujii (voice), Kaito Ishikawa, Shinta Takagi (voice), Kanon Tani, Yotsuha Miyamizu (voice), Masaki Terasoma, Toshiki Miyamizu (voice), Sayaka Ohara, Futaha Miyamizu (voice)","Romance, Animation, Drama",8.514
Fantastic Beasts: The Crimes of Grindelwald,2018-11-14,200000000,"Eddie Redmayne, Newt Scamander, Katherine Waterston, Porpentina 'Tina' Goldstein, Dan Fogler, Jacob Kowalski, Alison Sudol, Queenie Goldstein, Johnny Depp, Gellert Grindelwald, Jude Law, Albus Dumbledore, Ezra Miller, Credence Barebone, Zoë Kravitz, Leta Lestrange, Callum Turner, Theseus Scamander","Fantasy, Adventure, Family",6.876
Die Hard,1988-07-15,28000000,"Bruce Willis, John McClane, Alan Rickman, Hans Gruber, Alexander Godunov, Karl, Bonnie Bedelia, Holly Gennaro McClane, Reginald VelJohnson, Al Powell, Paul Gleason, Dwayne Robinson, De'voreaux White, Argyle, William Atherton, Richard Thornburg, Hart Bochner, Harry Ellis","Action, Thriller",7.775
Now You See Me 2,2016-06-02,90000000,"Jesse Eisenberg, J. Daniel Atlas, Mark Ruffalo, Dylan Rhodes, Woody Harrelson, Merritt McKinney / Chase McKinney, Morgan Freeman, Thaddeus Bradley, Dave Franco, Jack Wilder, Daniel Radcliffe, Walter Mabry, Lizzy Caplan, Lula, Michael Caine, Arthur Tressler, Jay Chou, Li","Crime, Thriller, Action, Mystery",6.83
Home Alone,1990-11-16,18000000,,,7.412
The Matrix Reloaded,2003-05-15,150000000,"Keanu Reeves, Thomas A. Anderson / Neo, Laurence Fishburne, Morpheus, Carrie-Anne Moss, Trinity, Hugo Weaving, Agent Smith, Jada Pinkett Smith, Niobe, Gloria Foster, Oracle, Harold Perrineau, Link, Monica Bellucci, Persephone, Harry Lennix, Commander Lock","Adventure, Action, Thriller, Science Fiction",7.039
Madagascar,2005-05-25,75000000,"Ben Stiller, Alex (voice), Chris Rock, Marty (voice), David Schwimmer, Melman (voice), Jada Pinkett Smith, Gloria (voice), Sacha Baron Cohen, Julien (voice), Cedric the Entertainer, Maurice (voice), Andy Richter, Mort (voice), Tom McGrath, Skipper / Fossa / Panicky Man on Subway (voice), Christopher Knights, Private (voice)","Family, Animation, Adventure, Comedy",6.892
The Theory of Everything,2014-11-26,15000000,"Eddie Redmayne, Stephen Hawking, Felicity Jones, Jane Hawking, Charlie Cox, Jonathan Hellyer Jones, Emily Watson, Beryl Wilde, Simon McBurney, Frank Hawking, David Thewlis, Dennis Sciama, Maxine Peake, Elaine Mason, Harry Lloyd, Brian, Tom Prior, Robert Hawking (Age 17)","Drama, Romance",7.86
Nightcrawler,2014-10-23,8500000,"Jake Gyllenhaal, Louis Bloom, Rene Russo, Nina Romina, Riz Ahmed, Rick, Bill Paxton, Joe Loder, Kevin Rahm, Frank Kruse, Michael Hyatt, Detective Frontieri, Price Carson, Detective Lieberman, Kent Shocknek, Kent Shocknek, Sharon Tay, Sharon Tay","Crime, Drama, Thriller",7.703
Fast & Furious 6,2013-05-21,160000000,,,6.817
Oblivion,2013-04-10,120000000,"Tom Cruise, Jack, Morgan Freeman, Beech, Olga Kurylenko, Julia, Andrea Riseborough, Victoria, Nikolaj Coster-Waldau, Sykes, Melissa Leo, Sally, Zoë Bell, Kara, Abigail Lowe, Julia's Child, Isabelle Lowe, Julia's Child","Action, Science Fiction, Adventure, Mystery",6.618
Bruce Almighty,2003-05-23,80000000,"Jim Carrey, Bruce Nolan, Morgan Freeman, God, Jennifer Aniston, Grace Connelly, Philip Baker Hall, Jack Baylor, Catherine Bell, Susan Ortega, Lisa Ann Walter, Debbie, Steve Carell, Evan Baxter, Nora Dunn, Ally Loman, Eddie Jemison, Bobby","Fantasy, Comedy",6.706
Gran Torino,2008-12-12,33000000,"Clint Eastwood, Walt Kowalski, Christopher Carley, Father Janovich, Bee Vang, Tao Vang Lor, Ahney Her, Sue Lor, Brian Haley, Mitch Kowalski, Geraldine Hughes, Karen Kowalski, Dreama Walker, Ashley Kowalski, Brian Howe, Steve Kowalski, John Carroll Lynch, Barber Martin",Drama,7.994
Furious 7,2015-04-01,190000000,"Vin Diesel, Dominic Toretto, Paul Walker, Brian O'Conner, Dwayne Johnson, Luke Hobbs, Jason Statham, Deckard Shaw, Michelle Rodriguez, Leticia 'Letty' Ortiz, Tyrese Gibson, Roman Pearce, Ludacris, Tej Parker, Jordana Brewster, Mia Toretto, Djimon Hounsou, Jakande","Action, Thriller, Crime",7.238
Minions,2015-06-17,74000000,"Sandra Bullock, Scarlet Overkill (voice), Jon Hamm, Herb Overkill (voice), Michael Keaton, Walter Nelson (voice), Allison Janney, Madge Nelson (voice), Steve Coogan, Professor Flux / Tower Guard (voice), Jennifer Saunders, Reine Elizabeth II (voice), Geoffrey Rush, Narrator (voice), Steve Carell, Gru (voice), Pierre Coffin, Stuart / Kevin / Bob (voice)","Family, Animation, Adventure, Comedy",6.395
Casino Royale,2006-11-14,150000000,"Daniel Craig, James Bond, Eva Green, Vesper Lynd, Mads Mikkelsen, Le Chiffre, Judi Dench, M, Jeffrey Wright, Felix Leiter, Giancarlo Giannini, René Mathis, Caterina Murino, Solange Dimitrios, Simon Abkarian, Alex Dimitrios, Isaach De Bankolé, Steven Obanno","Adventure, Action, Thriller",7.543
The Fifth Element,1997-05-02,90000000,"Bruce Willis, Korben Dallas, Milla Jovovich, Leeloo, Gary Oldman, Jean-Baptiste Emmanuel Zorg, Ian Holm, Father Vito Cornelius, Chris Tucker, Ruby Rhod, Luke Perry, Billy, Brion James, General Munro, Tom 'Tiny' Lister Jr., President Lindberg, Lee Evans, Fog","Adventure, Fantasy, Action, Thriller, Science Fiction",7.53
Slumdog Millionaire,2008-11-12,15000000,"Dev Patel, Older Jamal, Saurabh Shukla, Sergeant Srinivas, Anil Kapoor, Prem, Raj Zutshi, Director, Jeneva Talwar, Vision Mixer, Freida Pinto, Older Latika, Irrfan Khan, Police Inspector, Azharuddin Mohammed Ismail, Youngest Salim, Ayush Mahesh Khedekar, Youngest Jamal","Drama, Romance",7.734
Monsters University,2013-06-19,200000000,"Billy Crystal, Mike Wazowski (voice), John Goodman, James 'Sulley' Sullivan (voice), Steve Buscemi, Randall Boggs (voice), Helen Mirren, Dean Hardscrabble (voice), Peter Sohn, Scott 'Squishy' Squibbles (voice), Joel Murray, Don Carlton (voice), Sean Hayes, Terri Perry (voice), Dave Foley, Terry Perry (voice), Charlie Day, Art (voice)","Animation, Family",7.0
Limitless,2011-03-08,27000000,"Bradley Cooper, Eddie Morra, Robert De Niro, Carl Van Loon, Abbie Cornish, Lindy, Andrew Howard, Gennady, Anna Friel, Melissa, Johnny Whitworth, Vernon, Tomas Arana, Man in Tan Coat, Robert John Burke, Pierce, Darren Goldstein, Kevin Doyle","Thriller, Mystery, Science Fiction",7.186
Spectre,2015-10-26,245000000,"Daniel Craig, James Bond, Christoph Waltz, Franz Oberhauser / Ernst Stavro Blofeld, Léa Seydoux, Dr. Madeleine Swann, Ralph Fiennes, M, Naomie Harris, Eve Moneypenny, Ben Whishaw, Q, Monica Bellucci, Lucia Sciarra, Dave Bautista, Mr. Hinx, Andrew Scott, Max Denbigh / C","Action, Adventure, Thriller",6.533
The Perks of Being a Wallflower,2012-09-20,13000000,"Logan Lerman, Charlie, Emma Watson, Sam, Ezra Miller, Patrick, Mae Whitman, Mary Elizabeth, Kate Walsh, Mother, Dylan McDermott, Father, Melanie Lynskey, Aunt Helen, Nina Dobrev, Candace, Johnny Simmons, Brad",Drama,7.8
Pan's Labyrinth,2006-10-10,19000000,"Ivana Baquero, Ofelia, Maribel Verdú, Mercedes, Sergi López, Capitán Vidal, Doug Jones, Fauno / Pale Man, Ariadna Gil, Carmen, Álex Angulo, Dr. Ferreiro, Roger Casamajor, Pedro, Manolo Solo, Garcés, César Vea, Serrano","Fantasy, Drama, War",7.757
Jumanji,1995-12-15,65000000,"Robin Williams, Alan Parrish, Kirsten Dunst, Judy Shepherd, Bradley Pierce, Peter Shepherd, Bonnie Hunt, Sarah Whittle, Jonathan Hyde, Samuel Alan Parrish / Van Pelt, Bebe Neuwirth, Nora Shepherd, David Alan Grier, Carl Bentley, Adam Hann-Byrd, Young Alan, Patricia Clarkson, Carol Anne Parrish","Adventure, Fantasy, Family",7.239
Avatar: The Way of Water,2022-12-14,460000000,"Sam Worthington, Jake Sully, Zoe Saldaña, Neytiri, Sigourney Weaver, Kiri / Dr. Grace Augustine, Stephen Lang, Colonel Miles Quaritch, Kate Winslet, Ronal, Cliff Curtis, Tonowari, Joel David Moore, Norm Spellman, CCH Pounder, Mo'at, Edie Falco, General Frances Ardmore","Science Fiction, Adventure, Action",7.654
"The Chronicles of Narnia: The Lion, the Witch and the Wardrobe",2005-12-07,180000000,"Georgie Henley, Lucy Pevensie, Skandar Keynes, Edmund Pevensie, William Moseley, Peter Pevensie, Anna Popplewell, Susan Pevensie, Tilda Swinton, White Witch, James McAvoy, Mr. Tumnus, Jim Broadbent, Professor Kirke, Kiran Shah, Ginarrbrik, James Cosmo, Father Christmas","Adventure, Family, Fantasy",7.126
American Psycho,2000-04-13,7000000,"Christian Bale, Patrick Bateman, Willem Dafoe, Detective Donald Kimball, Jared Leto, Paul Allen, Josh Lucas, Craig McDermott, Samantha Mathis, Courtney Rawlinson, Matt Ross, Luis Carruthers, Bill Sage, David Van Patten, Chloë Sevigny, Jean, Cara Seymour, Christie","Thriller, Drama, Crime",7.4
X-Men Origins: Wolverine,2009-04-28,150000000,,,6.254
The Hangover Part II,2011-05-25,80000000,"Bradley Cooper, Phil Wenneck, Ed Helms, Stu Price, Zach Galifianakis, Alan Garner, Justin Bartha, Doug Billings, Ken Jeong, Mr. Chow, Paul Giamatti, Kingsley, Mike Tyson, Himself, Jeffrey Tambor, Sid Garner, Mason Lee, Teddy",Comedy,6.468
Sherlock Holmes: A Game of Shadows,2011-11-22,125000000,"Robert Downey Jr., Sherlock Holmes, Jude Law, Dr. John Watson, Noomi Rapace, Madam Simza Heron, Jared Harris, Professor James Moriarty, Rachel McAdams, Irene Adler, Eddie Marsan, Inspector Lestrade, Kelly Reilly, Mary Morstan, Stephen Fry, Mycroft Holmes, Paul Anderson, Colonel Sebastian Moran","Adventure, Action, Crime, Mystery",7.13
The Fate of the Furious,2017-04-12,250000000,"Vin Diesel, Dominic Toretto, Jason Statham, Deckard Shaw, Dwayne Johnson, Luke Hobbs, Michelle Rodriguez, Letty Ortiz, Tyrese Gibson, Roman Pearce, Ludacris, Tej Parker, Charlize Theron, Cipher, Kurt Russell, Mr. Nobody, Nathalie Emmanuel, Ramsey","Action, Crime, Thriller",6.887
John Wick: Chapter 3 - Parabellum,2019-05-15,55000000,"Keanu Reeves, John Wick, Halle Berry, Sofia, Ian McShane, Winston, Laurence Fishburne, Bowery King, Mark Dacascos, Zero, Asia Kate Dillon, Adjudicator, Lance Reddick, Charon, Anjelica Huston, Director, Tobias Segal, Earl","Action, Thriller, Crime",7.447
Kong: Skull Island,2017-03-08,185000000,"Tom Hiddleston, Captain James Conrad, Samuel L. Jackson, Lieutenant Colonel Preston Packard, John Goodman, Bill Randa, Brie Larson, Mason Weaver, Jing Tian, San Lin, Toby Kebbell, Maj. Jack Chapman / Kong Mo-Cap Services, John Ortiz, Victor Nieves, Corey Hawkins, Houston Brooks, Jason Mitchell, Glenn Mills","Action, Adventure, Fantasy",6.514
Back to the Future Part III,1990-05-25,40000000,"Michael J. Fox, Marty McFly / Seamus McFly, Christopher Lloyd, Emmett Brown, Thomas F. Wilson, Buford ""Mad Dog"" Tannen / Biff Tannen, Mary Steenburgen, Clara Clayton, Lea Thompson, Maggie McFly / Lorraine McFly, Elisabeth Shue, Jennifer Parker, Matt Clark, Bartender, Richard Dysart, Barbwire Salesman, Pat Buttram, Saloon Old Timer","Adventure, Comedy, Science Fiction",7.465
Men in Black 3,2012-05-23,225000000,"Will Smith, Agent J, Tommy Lee Jones, Agent K, Josh Brolin, Young Agent K, Jemaine Clement, Boris The Animal, Emma Thompson, Agent O, Michael Stuhlbarg, Griffin, Mike Colter, Colonel, Nicole Scherzinger, Boris's Girlfriend, Michael Chernus, Jeffrey Price","Action, Comedy, Science Fiction",6.51
