Inception,2010-07-15,160000000,"Leonardo DiCaprio, Dom Cobb, Joseph Gordon-Levitt, Arthur, Ken Watanabe, Saito, Tom Hardy, Eames, Elliot Page, Ariadne, Dileep Rao, Yusuf, Cillian Murphy, Robert Fischer, Jr., Tom Berenger, Peter Browning, Marion Cotillard, Mal Cobb","Action, Science Fiction, Adventure",8.364
Interstellar,2014-11-05,165000000,"Matthew McConaughey, Joseph ""Coop"" Cooper, Anne Hathaway, Dr. Amelia Brand, Jessica Chastain, Murphy ""Murph"" Cooper, Bill Irwin, TARS (voice), Ellen Burstyn, Old Murph, Michael Caine, Professor John Brand, Mackenzie Foy, Young Murph, Casey Affleck, Tom Cooper, John Lithgow, Donald","Adventure, Drama, Science Fiction",8.417
The Dark Knight,2008-07-16,185000000,"Christian Bale, Bruce Wayne / Batman, Heath Ledger, Joker, Michael Caine, Alfred Pennyworth, Gary Oldman, James Gordon, Aaron Eckhart, Harvey Dent / Two-Face, Maggie Gyllenhaal, Rachel Dawes, Morgan Freeman, Lucius Fox, Nestor Carbonell, Anthony Garcia, Monique Gabriela Curnen, Anna Ramirez","Drama, Action, Crime, Thriller",8.512
Avatar,2009-12-15,237000000,"Sam Worthington, Jake Sully, Zoe Saldaña, Neytiri, Sigourney Weaver, Dr. Grace Augustine, Stephen Lang, Colonel Miles Quaritch, Michelle Rodriguez, Trudy Chacon, Giovanni Ribisi, Parker Selfridge, Joel David Moore, Norm Spellman, CCH Pounder, Mo'at, Wes Studi, Eytukan","Action, Adventure, Fantasy, Science Fiction",7.573
The Avengers,2012-04-25,220000000,"Robert Downey Jr., Tony Stark / Iron Man, Chris Evans, Steve Rogers / Captain America, Mark Ruffalo, Bruce Banner / The Hulk, Chris Hemsworth, Thor Odinson, Scarlett Johansson, Natasha Romanoff / Black Widow, Jeremy Renner, Clint Barton / Hawkeye, Tom Hiddleston, Loki, Samuel L. Jackson, Nick Fury, Cobie Smulders, Maria Hill","Science Fiction, Action, Adventure",7.71
Deadpool,2016-02-09,58000000,"Ryan Reynolds, Wade Wilson / Deadpool, Morena Baccarin, Vanessa, Ed Skrein, Ajax, T.J. Miller, Weasel, Gina Carano, Angel Dust, Leslie Uggams, Blind Al, Brianna Hildebrand, Negasonic Teenage Warhead, Karan Soni, Dopinder, Jed Rees, Recruiter","Action, Adventure, Comedy",7.606
Avengers: Infinity War,2018-04-25,300000000,"Robert Downey Jr., Tony Stark / Iron Man, Chris Hemsworth, Thor Odinson, Mark Ruffalo, Bruce Banner / Hulk, Chris Evans, Steve Rogers / Captain America, Scarlett Johansson, Natasha Romanoff / Black Widow, Benedict Cumberbatch, Stephen Strange / Doctor Strange, Tom Holland, Peter Parker / Spider-Man, Chadwick Boseman, T'Challa / Black Panther, Don Cheadle, James 'Rhodey' Rhodes / War Machine","Adventure, Action, Science Fiction",8.255
Fight Club,1999-10-15,63000000,"Edward Norton, The Narrator, Brad Pitt, Tyler Durden, Helena Bonham Carter, Marla Singer, Meat Loaf, Robert ""Bob"" Paulson, Jared Leto, Angel Face, Zach Grenier, Richard Chesler, Holt McCallany, The Mechanic, Eion Bailey, Ricky, Richmond Arquette, Intern","Drama, Thriller, Comedy",8.438
Guardians of the Galaxy,2014-07-30,170000000,"Chris Pratt, Peter Quill / Star-Lord, Zoe Saldaña, Gamora, Dave Bautista, Drax the Destroyer, Vin Diesel, Groot (voice), Bradley Cooper, Rocket (voice), Lee Pace, Ronan the Accuser, Michael Rooker, Yondu Udonta, Karen Gillan, Nebula, Djimon Hounsou, Korath","Action, Science Fiction, Adventure",7.906
Pulp Fiction,1994-09-10,8500000,"John Travolta, Vincent Vega, Samuel L. Jackson, Jules Winnfield, Uma Thurman, Mia Wallace, Bruce Willis, Butch Coolidge, Ving Rhames, Marsellus Wallace, Harvey Keitel, Winston ""The Wolf"" Wolfe, Eric Stoltz, Lance, Tim Roth, Ringo (""Pumpkin""), Amanda Plummer, Yolanda (""Honey Bunny"")","Thriller, Crime",8.488
Forrest Gump,1994-06-23,55000000,"Tom Hanks, Forrest Gump, Robin Wright, Jenny Curran, Gary Sinise, Lieutenant Dan Taylor, Sally Field, Mrs. Gump, Mykelti Williamson, Benjamin Buford 'Bubba' Blue, Michael Conner Humphreys, Young Forrest Gump, Hanna Hall, Young Jenny Curran, Haley Joel Osment, Forrest Junior, Siobhan Fallon Hogan, School Bus Driver","Comedy, Drama, Romance",8.477
Harry Potter and the Philosopher's Stone,2001-11-16,125000000,"Daniel Radcliffe, Harry Potter, Rupert Grint, Ron Weasley, Emma Watson, Hermione Granger, Richard Harris, Albus Dumbledore, Tom Felton, Draco Malfoy, Alan Rickman, Severus Snape, Robbie Coltrane, Rubeus Hagrid, Maggie Smith, Minerva McGonagall, Richard Griffiths, Vernon Dursley","Adventure, Fantasy",7.916
Iron Man,2008-04-30,140000000,"Robert Downey Jr., Tony Stark / Iron Man, Terrence Howard, James 'Rhodey' Rhodes, Jeff Bridges, Obadiah Stane / Iron Monger, Gwyneth Paltrow, Virginia 'Pepper' Potts, Leslie Bibb, Christine Everhart, Bill Smitrovich, General Gabriel, Paul Bettany, J.A.R.V.I.S. (voice), Jon Favreau, Harold 'Happy' Hogan, Shaun Toub, Yinsen","Action, Science Fiction, Adventure",7.64
Django Unchained,2012-12-25,100000000,"Jamie Foxx, Django Freeman, Christoph Waltz, Dr. King Schultz, Leonardo DiCaprio, Calvin J. Candie, Kerry Washington, Broomhilda von Shaft, Samuel L. Jackson, Stephen, Walton Goggins, Billy Crash, Dennis Christopher, Leonide Moguy, James Remar, Butch Pooch / Ace Speck, David Steen, Mr. Stonesipher","Drama, Western",8.171
The Shawshank Redemption,1994-09-23,25000000,"Tim Robbins, Andy Dufresne, Morgan Freeman, Ellis Boyd 'Red' Redding, Bob Gunton, Warden Norton, William Sadler, Heywood, Clancy Brown, Captain Byron T. Hadley, Gil Bellows, Tommy, Mark Rolston, Bogs Diamond, James Whitmore, Brooks Hatlen, Jeffrey DeMunn, 1946 D.A.","Drama, Crime",8.702
Avengers: Endgame,2019-04-24,356000000,"Robert Downey Jr., Tony Stark / Iron Man, Chris Evans, Steve Rogers / Captain America, Mark Ruffalo, Bruce Banner / Hulk, Chris Hemsworth, Thor Odinson, Scarlett Johansson, Natasha Romanoff / Black Widow, Jeremy Renner, Clint Barton / Hawkeye, Don Cheadle, James Rhodes / War Machine, Paul Rudd, Scott Lang / Ant-Man, Benedict Cumberbatch, Stephen Strange / Doctor Strange","Adventure, Science Fiction, Action",8.263
The Matrix,1999-03-30,63000000,"Keanu Reeves, Thomas A. Anderson / Neo, Laurence Fishburne, Morpheus, Carrie-Anne Moss, Trinity, Hugo Weaving, Agent Smith, Joe Pantoliano, Cypher, Marcus Chong, Tank, Anthony Ray Parker, Dozer, Matt Doran, Mouse, Gloria Foster, Oracle","Action, Science Fiction",8.206
Titanic,1997-11-18,200000000,"Leonardo DiCaprio, Jack Dawson, Kate Winslet, Rose DeWitt Bukater, Billy Zane, Cal Hockley, Kathy Bates, Molly Brown, Frances Fisher, Ruth DeWitt Bukater, Gloria Stuart, Old Rose, Victor Garber, Thomas Andrews, Bill Paxton, Brock Lovett, Bernard Hill, Edward Smith","Drama, Romance",7.9
Joker,2019-10-01,55000000,"Joaquin Phoenix, Arthur Fleck / Joker, Robert De Niro, Murray Franklin, Zazie Beetz, Sophie Dumond, Frances Conroy, Penny Fleck, Brett Cullen, Thomas Wayne, Shea Whigham, Detective Burke, Bill Camp, Detective Garrity, Glenn Fleshler, Randall, Leigh Gill, Gary","Crime, Thriller, Drama",8.168
The Lord of the Rings: The Fellowship of the Ring,2001-12-18,93000000,"Elijah Wood, Frodo, Ian McKellen, Gandalf, Liv Tyler, Arwen, Viggo Mortensen, Aragorn, Sean Astin, Sam, Sean Bean, Boromir, Cate Blanchett, Galadriel, John Rhys-Davies, Gimli, Billy Boyd, Pippin","Adventure, Fantasy, Action",8.402
The Lord of the Rings: The Return of the King,2003-12-01,94000000,"Elijah Wood, Frodo, Ian McKellen, Gandalf, Liv Tyler, Arwen, Viggo Mortensen, Aragorn, Sean Astin, Sam, Andy Serkis, Gollum / Sméagol, Cate Blanchett, Galadriel, John Rhys-Davies, Gimli / Treebeard (voice), Bernard Hill, Théoden","Adventure, Fantasy, Action",8.474
Shutter Island,2010-02-14,80000000,"Leonardo DiCaprio, Teddy Daniels, Mark Ruffalo, Chuck Aule, Ben Kingsley, Dr. John Cawley, Michelle Williams, Dolores Chanal, Max von Sydow, Dr. Jeremiah Naehring, Emily Mortimer, Rachel Solando, Jackie Earle Haley, George Noyce, John Carroll Lynch, Deputy Warden McPherson, Ted Levine, Warden","Drama, Thriller, Mystery",8.2
The Wolf of Wall Street,2013-12-25,100000000,"Leonardo DiCaprio, Jordan Belfort, Jonah Hill, Donnie Azoff, Margot Robbie, Naomi Lapaglia, Matthew McConaughey, Mark Hanna, Kyle Chandler, FBI Agent Patrick Denham, Rob Reiner, Max Belfort, Jon Favreau, Manny Riskin, Jean Dujardin, Jean-Jacques Handali, Jon Bernthal, Brad Bodnick","Crime, Drama, Comedy",8.035
Avengers: Age of Ultron,2015-04-22,365000000,"Robert Downey Jr., Tony Stark / Iron Man, Chris Hemsworth, Thor Odinson, Mark Ruffalo, Bruce Banner / The Hulk, Chris Evans, Steve Rogers / Captain America, Scarlett Johansson, Natasha Romanoff / Black Widow, Jeremy Renner, Clint Barton / Hawkeye, James Spader, Ultron (voice), Samuel L. Jackson, Nick Fury, Don Cheadle, James ""Rhodey"" Rhodes / War Machine","Action, Adventure, Science Fiction",7.276
Captain America: Civil War,2016-04-27,250000000,"Chris Evans, Steve Rogers / Captain America, Robert Downey Jr., Tony Stark / Iron Man, Scarlett Johansson, Natasha Romanoff / Black Widow, Sebastian Stan, James 'Bucky' Barnes / Winter Soldier, Anthony Mackie, Sam Wilson / Falcon, Don Cheadle, Lieutenant James 'Rhodey' Rhodes / War Machine, Jeremy Renner, Clint Barton / Hawkeye, Chadwick Boseman, T'Challa / Black Panther, Paul Bettany, Vision","Adventure, Action, Science Fiction",7.4
The Dark Knight Rises,2012-07-17,250000000,"Christian Bale, Bruce Wayne / Batman, Michael Caine, Alfred Pennyworth, Gary Oldman, James Gordon, Anne Hathaway, Selina Kyle / Catwoman, Tom Hardy, Bane, Marion Cotillard, Miranda Tate / Talia al Ghul, Joseph Gordon-Levitt, John Blake, Morgan Freeman, Lucius Fox, Matthew Modine, Peter Foley","Action, Crime, Drama, Thriller",7.777
Iron Man 3,2013-04-18,200000000,"Robert Downey Jr., Tony Stark / Iron Man, Gwyneth Paltrow, Virginia 'Pepper' Potts, Don Cheadle, James 'Rhodey' Rhodes / Iron Patriot, Guy Pearce, Aldrich Killian / The Mandarin, Rebecca Hall, Maya Hansen, Jon Favreau, Harold 'Happy' Hogan, Ben Kingsley, Trevor Slattery / The Mandarin, Stephanie Szostak, Brandt, James Badge Dale, Savin","Action, Adventure, Science Fiction",6.928
Black Panther,2018-02-13,200000000,"Chadwick Boseman, King T'Challa / Black Panther, Michael B. Jordan, N'Jadaka / Erik 'Killmonger' Stevens, Lupita Nyong'o, Nakia, Danai Gurira, Okoye, Martin Freeman, Everett K. Ross, Daniel Kaluuya, W'Kabi, Letitia Wright, Shuri, Winston Duke, M'Baku, Sterling K. Brown, N'Jobu","Action, Adventure, Science Fiction",7.39
Doctor Strange,2016-10-25,180000000,"Benedict Cumberbatch, Stephen Strange / Doctor Strange, Chiwetel Ejiofor, Karl Mordo, Rachel McAdams, Dr. Christine Palmer, Benedict Wong, Wong, Mads Mikkelsen, Kaecilius, Tilda Swinton, The Ancient One, Michael Stuhlbarg, Dr. Nicodemus West, Benjamin Bratt, Jonathan Pangborn, Scott Adkins, Lucian / Strong Zealot","Action, Adventure, Fantasy",7.427
Mad Max: Fury Road,2015-05-13,150000000,"Tom Hardy, Max Rockatansky, Charlize Theron, Imperator Furiosa, Nicholas Hoult, Nux, Hugh Keays-Byrne, Immortan Joe, Riley Keough, Capable, Zoë Kravitz, Toast the Knowing, Rosie Huntington-Whiteley, The Splendid Angharad, Abbey Lee, The Dag, Courtney Eaton, Cheedo the Fragile","Action, Adventure, Science Fiction",7.582
Inglourious Basterds,2009-08-19,70000000,"Brad Pitt, First Lieutenant Aldo ""The Apache"" Raine, Mélanie Laurent, Shosanna Dreyfus / Emmanuelle Mimieux, Christoph Waltz, SS Colonel Hans ""The Jew Hunter"" Landa, Eli Roth, Staff Sergeant Donny ""The Bear Jew"" Donowitz, Michael Fassbender, Lieutenant Archie Hicox, Diane Kruger, Bridget von Hammersmark, Daniel Brühl, Private First Class Fredrick Zoller, Til Schweiger, Sergeant Hugo Stiglitz, Gedeon Burkhard, Corporal Wilhelm Wicki","Drama, Thriller, War",8.215
The Hunger Games,2012-03-12,75000000,"Jennifer Lawrence, Katniss Everdeen, Josh Hutcherson, Peeta Mellark, Liam Hemsworth, Gale Hawthorne, Woody Harrelson, Haymitch Abernathy, Elizabeth Banks, Effie Trinket, Lenny Kravitz, Cinna, Stanley Tucci, Caesar Flickerman, Donald Sutherland, President Snow, Wes Bentley, Seneca Crane","Science Fiction, Adventure, Fantasy",7.193
Spider-Man: Homecoming,2017-07-05,175000000,"Tom Holland, Peter Parker / Spider-Man, Michael Keaton, Adrian Toomes / Vulture, Robert Downey Jr., Tony Stark / Iron Man, Marisa Tomei, May Parker, Jon Favreau, Harold 'Happy' Hogan, Gwyneth Paltrow, Virginia 'Pepper' Potts, Zendaya, Michelle 'MJ' Jones, Donald Glover, Aaron Davis, Jacob Batalon, Ned","Action, Adventure, Science Fiction, Drama",7.345
Harry Potter and the Chamber of Secrets,2002-11-13,100000000,"Daniel Radcliffe, Harry Potter, Rupert Grint, Ron Weasley, Emma Watson, Hermione Granger, Kenneth Branagh, Gilderoy Lockhart, John Cleese, Nearly Headless Nick (Sir Nicholas), Robbie Coltrane, Rubeus Hagrid, Warwick Davis, Filius Flitwick, Richard Griffiths, Vernon Dursley, Richard Harris, Albus Dumbledore","Adventure, Fantasy",7.721
Guardians of the Galaxy Vol. 2,2017-04-19,200000000,"Chris Pratt, Peter Quill / Star-Lord, Zoe Saldaña, Gamora, Dave Bautista, Drax the Destroyer, Vin Diesel, Baby Groot (voice), Bradley Cooper, Rocket (voice), Kurt Russell, Ego, Michael Rooker, Yondu Udonta, Karen Gillan, Nebula, Pom Klementieff, Mantis","Adventure, Action, Science Fiction",7.624
The Lord of the Rings: The Two Towers,2002-12-18,79000000,"Elijah Wood, Frodo, Ian McKellen, Gandalf, Liv Tyler, Arwen, Viggo Mortensen, Aragorn, Sean Astin, Sam, Andy Serkis, Gollum, Cate Blanchett, Galadriel, John Rhys-Davies, Gimli / Treebeard (voice), Bernard Hill, Théoden","Adventure, Fantasy, Action",8.385
Captain America: The First Avenger,2011-07-22,140000000,"Chris Evans, Steve Rogers / Captain America, Tommy Lee Jones, Chester Phillips, Hugo Weaving, Johann Schmidt / Red Skull, Hayley Atwell, Peggy Carter, Sebastian Stan, James Buchanan 'Bucky' Barnes, Dominic Cooper, Howard Stark, Toby Jones, Dr. Arnim Zola, Neal McDonough, Timothy 'Dum Dum' Dugan, Derek Luke, Gabe Jones","Action, Adventure, Science Fiction",6.995
Suicide Squad,2016-08-03,175000000,"Will Smith, Floyd Lawton / Deadshot, Jared Leto, The Joker, Margot Robbie, Harleen Quinzel / Harley Quinn, Joel Kinnaman, Rick Flag, Viola Davis, Amanda Waller, Jai Courtney, George 'Digger' Harkness / Boomerang, Jay Hernandez, Chato Santana / El Diablo, Adewale Akinnuoye-Agbaje, Waylon Jones / Killer Croc, Cara Delevingne, June Moone / Enchantress","Action, Adventure, Fantasy",5.909
Harry Potter and the Prisoner of Azkaban,2004-05-31,130000000,"Daniel Radcliffe, Harry Potter, Rupert Grint, Ron Weasley, Emma Watson, Hermione Granger, Robbie Coltrane, Rubeus Hagrid, Michael Gambon, Albus Dumbledore, Gary Oldman, Sirius Black, Alan Rickman, Severus Snape, Timothy Spall, Peter Pettigrew, David Thewlis, Remus Lupin","Adventure, Fantasy",8.02
Thor,2011-04-21,150000000,"Chris Hemsworth, Thor Odinson, Natalie Portman, Jane Foster, Tom Hiddleston, Loki, Anthony Hopkins, Odin, Stellan Skarsgård, Erik Selvig, Kat Dennings, Darcy Lewis, Clark Gregg, Phil Coulson, Colm Feore, King Laufey, Idris Elba, Heimdall","Adventure, Fantasy, Action",6.768
Iron Man 2,2010-04-28,200000000,"Robert Downey Jr., Tony Stark / Iron Man, Gwyneth Paltrow, Virginia 'Pepper' Potts, Don Cheadle, James 'Rhodey' Rhodes / War Machine, Scarlett Johansson, Natalie Rushman / Natasha Romanoff / Black Widow, Sam Rockwell, Justin Hammer, Mickey Rourke, Ivan Vanko / Whiplash, Samuel L. Jackson, Nick Fury, Clark Gregg, Phil Coulson, John Slattery, Howard Stark","Adventure, Action, Science Fiction",6.835
Batman Begins,2005-06-10,150000000,"Christian Bale, Bruce Wayne / Batman, Michael Caine, Alfred Pennyworth, Liam Neeson, Henri Ducard / Ra's al Ghul, Katie Holmes, Rachel Dawes, Gary Oldman, James Gordon, Cillian Murphy, Jonathan Crane / Scarecrow, Tom Wilkinson, Carmine ""The Roman"" Falcone, Rutger Hauer, William Earle, Ken Watanabe, Decoy Ra's al Ghul","Action, Crime, Drama",7.701
Thor: Ragnarok,2017-10-02,180000000,"Chris Hemsworth, Thor Odinson, Tom Hiddleston, Loki, Cate Blanchett, Hela, Tessa Thompson, Scrapper 142 / Valkyrie, Jeff Goldblum, En Dwi Gast / Grandmaster, Idris Elba, Heimdall, Karl Urban, Skurge / Executioner, Mark Ruffalo, Bruce Banner / Hulk, Anthony Hopkins, Odin","Action, Adventure, Fantasy, Science Fiction, Comedy",7.595
Inside Out,2015-06-09,175000000,"Amy Poehler, Joy (voice), Phyllis Smith, Sadness (voice), Bill Hader, Fear (voice), Kaitlyn Dias, Riley (voice), Richard Kind, Bing Bong (voice), Lewis Black, Anger (voice), Mindy Kaling, Disgust (voice), Diane Lane, Mom (voice), Kyle MacLachlan, Dad (voice)","Animation, Family, Adventure, Drama, Comedy",7.922
Jurassic World,2015-06-06,150000000,"Chris Pratt, Owen Grady, Bryce Dallas Howard, Claire Dearing, Ty Simpkins, Gray Mitchell, Nick Robinson, Zach Mitchell, Vincent D'Onofrio, Vic Hoskins, BD Wong, Dr. Henry Wu, Omar Sy, Barry Sembène, Jake Johnson, Lowery Cruthers, Irrfan Khan, Simon Masrani","Action, Adventure, Science Fiction, Thriller",6.682
Se7en,1995-09-22,33000000,"Brad Pitt, Detective David Mills, Morgan Freeman, Detective Lt. William Somerset, Gwyneth Paltrow, Tracy Mills, R. Lee Ermey, Police Captain, John C. McGinley, California, Julie Araskog, Mrs. Gould, Mark Boone Junior, Greasy F.B.I. Man, John Cassini, Officer Davis, Reg E. Cathey, Dr. Santiago","Crime, Mystery, Thriller",8.368
Harry Potter and the Goblet of Fire,2005-11-16,150000000,"Daniel Radcliffe, Harry Potter, Rupert Grint, Ron Weasley, Emma Watson, Hermione Granger, Brendan Gleeson, Alastor ""Mad-Eye"" Moody, Robbie Coltrane, Rubeus Hagrid, Robert Pattinson, Cedric Diggory, Michael Gambon, Albus Dumbledore, David Tennant, Barty Crouch Junior, Miranda Richardson, Rita Skeeter","Adventure, Fantasy, Family",7.816
Pirates of the Caribbean: The Curse of the Black Pearl,2003-07-09,140000000,"Johnny Depp, Jack Sparrow, Orlando Bloom, Will Turner, Keira Knightley, Elizabeth Swann, Geoffrey Rush, Hector Barbossa, Jack Davenport, James Norrington, Jonathan Pryce, Weatherby Swann, Lee Arenberg, Pintel, Mackenzie Crook, Ragetti, Damian O'Hare, Gillette","Adventure, Fantasy, Action",7.794
Harry Potter and the Deathly Hallows: Part 2,2011-07-12,125000000,"Daniel Radcliffe, Harry Potter, Rupert Grint, Ron Weasley, Emma Watson, Hermione Granger, Ralph Fiennes, Lord Voldemort, Alan Rickman, Severus Snape, Helena Bonham Carter, Bellatrix Lestrange, Maggie Smith, Minerva McGonagall, Michael Gambon, Albus Dumbledore, John Hurt, Ollivander","Fantasy, Adventure",8.105
Star Wars,1977-05-25,11000000,"Mark Hamill, Luke Skywalker, Harrison Ford, Han Solo, Carrie Fisher, Princess Leia Organa, Peter Cushing, Grand Moff Tarkin, Alec Guinness, Obi-Wan ""Ben"" Kenobi, Anthony Daniels, C-3PO, Kenny Baker, R2-D2, Peter Mayhew, Chewbacca, David Prowse, Darth Vader (performer)","Adventure, Action, Science Fiction",8.204
Wonder Woman,2017-05-30,149000000,"Gal Gadot, Diana Prince / Wonder Woman, Chris Pine, Steve Trevor, Connie Nielsen, Hippolyta, Robin Wright, Antiope, Danny Huston, Ludendorff, David Thewlis, Sir Patrick / Ares, Saïd Taghmaoui, Sameer, Ewen Bremner, Charlie, Eugene Brave Rock, The Chief","Action, Adventure, Fantasy",7.236
Up,2009-05-28,175000000,"Ed Asner, Carl Fredricksen (voice), Christopher Plummer, Charles F. Muntz (voice), Jordan Nagai, Russell (voice), Bob Peterson, Dug / Alpha (voice), Delroy Lindo, Beta (voice), Jerome Ranft, Gamma (voice), John Ratzenberger, Construction Foreman Tom (voice), David Kaye, Newsreel Announcer (voice), Elie Docter, Young Ellie (voice)","Animation, Comedy, Family, Adventure",7.949
Ant-Man,2015-07-14,130000000,"Paul Rudd, Scott Lang / Ant-Man, Michael Douglas, Dr. Hank Pym, Evangeline Lilly, Hope van Dyne, Bobby Cannavale, Paxton, Corey Stoll, Darren Cross / Yellowjacket, Anthony Mackie, Sam Wilson / Falcon, Judy Greer, Maggie, Abby Ryder Fortson, Cassie Lang, Michael Peña, Luis","Science Fiction, Action, Adventure",7.082
The Godfather,1972-03-14,6000000,"Marlon Brando, Vito Corleone, Al Pacino, Michael Corleone, James Caan, Sonny Corleone, Richard S. Castellano, Peter Clemenza, Robert Duvall, Tom Hagen, Sterling Hayden, Captain McCluskey, John Marley, Jack Woltz, Richard Conte, Emilio Barzini, Diane Keaton, Kay Adams-Corleone","Drama, Crime",8.707
The Martian,2015-09-30,108000000,"Matt Damon, Mark Watney, Jessica Chastain, Melissa Lewis, Jeff Daniels, Teddy Sanders, Sean Bean, Mitch Henderson, Chiwetel Ejiofor, Vincent Kapoor, Donald Glover, Rich Purnell, Kristen Wiig, Annie Montrose, Michael Peña, Rick Martinez, Kate Mara, Beth Johanssen","Drama, Adventure, Science Fiction",7.678
Back to the Future,1985-07-03,19000000,"Michael J. Fox, Marty McFly, Christopher Lloyd, Emmett Brown, Lea Thompson, Lorraine Baines, Crispin Glover, George McFly, Thomas F. Wilson, Biff Tannen, Claudia Wells, Jennifer Parker, Marc McClure, Dave McFly, Wendie Jo Sperber, Linda McFly, George DiCenzo, Sam Baines","Adventure, Comedy, Science Fiction",8.314
Star Wars: The Force Awakens,2015-12-15,245000000,"Harrison Ford, Han Solo, Mark Hamill, Luke Skywalker, Carrie Fisher, General Leia Organa, Adam Driver, Kylo Ren / Ben Solo, Daisy Ridley, Rey, John Boyega, Finn, Oscar Isaac, Poe Dameron, Lupita Nyong'o, Maz Kanata, Andy Serkis, Supreme Leader Snoke","Adventure, Action, Science Fiction, Fantasy",7.293
Spider-Man: No Way Home,2021-12-15,200000000,"Tom Holland, Peter Parker / Spider-Man, Zendaya, Michelle 'MJ' Jones, Benedict Cumberbatch, Stephen Strange / Doctor Strange, Jacob Batalon, Ned Leeds, Jon Favreau, Harold 'Happy' Hogan, Jamie Foxx, Max Dillon / Electro, Willem Dafoe, Norman Osborn / Green Goblin, Alfred Molina, Dr. Otto Octavius / Doctor Octopus, Benedict Wong, Wong","Action, Adventure, Science Fiction",7.99
Harry Potter and the Order of the Phoenix,2007-07-08,150000000,"Daniel Radcliffe, Harry Potter, Rupert Grint, Ron Weasley, Emma Watson, Hermione Granger, Imelda Staunton, Dolores Umbridge, Helena Bonham Carter, Bellatrix Lestrange, Robbie Coltrane, Rubeus Hagrid, Ralph Fiennes, Lord Voldemort, Michael Gambon, Albus Dumbledore, Jason Isaacs, Lucius Malfoy","Adventure, Fantasy, Mystery",7.686
Harry Potter and the Half-Blood Prince,2009-07-15,250000000,"Daniel Radcliffe, Harry Potter, Rupert Grint, Ron Weasley, Emma Watson, Hermione Granger, Michael Gambon, Albus Dumbledore, Tom Felton, Draco Malfoy, Jim Broadbent, Horace Slughorn, Robbie Coltrane, Rubeus Hagrid, Alan Rickman, Severus Snape, Maggie Smith, Minerva McGonagall","Adventure, Fantasy",7.697
Logan,2017-02-28,97000000,"Hugh Jackman, Logan / Wolverine / X-24, Dafne Keen, Laura / X-23, Patrick Stewart, Charles Xavier / Professor X, Elizabeth Rodriguez, Gabriela, Boyd Holbrook, Pierce, Stephen Merchant, Caliban, Richard E. Grant, Dr. Rice, Stephen Dunlevy, Macon, Eriq La Salle, Will Munson","Action, Drama, Science Fiction",7.8
Finding Nemo,2003-05-30,94000000,"Albert Brooks, Marlin (voice), Ellen DeGeneres, Dory (voice), Alexander Gould, Nemo (voice), Willem Dafoe, Gill (voice), Brad Garrett, Bloat (voice), Allison Janney, Peach (voice), Austin Pendleton, Gurgle (voice), Stephen Root, Bubbles (voice), Vicki Lewis, Deb / Flo (voice)","Animation, Family",7.824
It,2017-09-06,40000000,"Jaeden Martell, Bill Denbrough, Bill Skarsgård, It, Jeremy Ray Taylor, Ben Hanscom, Sophia Lillis, Beverly Marsh, Finn Wolfhard, Richie Tozier, Chosen Jacobs, Mike Hanlon, Jack Dylan Grazer, Eddie Kaspbrak, Wyatt Oleff, Stanley Uris, Nicholas Hamilton, Henry Bowers","Horror, Fantasy",7.242
John Wick,2014-10-22,20000000,"Keanu Reeves, John Wick, Michael Nyqvist, Viggo Tarasov, Ian McShane, Winston, John Leguizamo, Aurelio, Willem Dafoe, Marcus, Alfie Allen, Iosef Tarasov, Dean Winters, Avi, Adrianne Palicki, Ms. Perkins, Lance Reddick, Hotel Manager / Charon","Action, Thriller",7.421
Fantastic Beasts and Where to Find Them,2016-11-16,180000000,"Eddie Redmayne, Newt Scamander, Katherine Waterston, Porpentina 'Tina' Goldstein, Dan Fogler, Jacob Kowalski, Alison Sudol, Queenie Goldstein, Colin Farrell, Percival Graves, Jon Voight, Henry Shaw Sr., Ron Perlman, Gnarlak, Johnny Depp, Gellert Grindelwald, Zoë Kravitz, Leta Lestrange","Adventure, Fantasy, Family",7.334
Harry Potter and the Deathly Hallows: Part 1,2010-11-17,250000000,"Daniel Radcliffe, Harry Potter, Rupert Grint, Ron Weasley, Emma Watson, Hermione Granger, Helena Bonham Carter, Bellatrix Lestrange, Robbie Coltrane, Rubeus Hagrid, Ralph Fiennes, Lord Voldemort, Michael Gambon, Albus Dumbledore, Bill Nighy, Rufus Scrimgeour, Brendan Gleeson, Alastor ""Mad-Eye"" Moody","Adventure, Fantasy",7.763
Coco,2017-10-27,175000000,"Anthony Gonzalez, Miguel Rivera (voice), Gael García Bernal, Héctor (voice), Benjamin Bratt, Ernesto de la Cruz (voice), Alanna Ubach, Mamá Imelda Rivera (voice), Renée Victor, Elena Rivera (voice), Jaime Camil, Papá Enrique Rivera (voice), Alfonso Arau, Papá Julio Rivera (voice), Herbert Siguenza, Tío Oscar Rivera / Tío Felipe Rivera (voice), Lombardo Boyar, Mariachi / Gustavo (voice)","Family, Animation, Fantasy, Music, Comedy, Adventure",8.222
Captain America: The Winter Soldier,2014-03-20,170000000,"Chris Evans, Steve Rogers / Captain America, Scarlett Johansson, Natasha Romanoff / Black Widow, Sebastian Stan, James 'Bucky' Barnes / Winter Soldier, Anthony Mackie, Sam Wilson / Falcon, Cobie Smulders, Maria Hill, Frank Grillo, Brock Rumlow, Emily VanCamp, Kate / Agent 13, Hayley Atwell, Peggy Carter, Robert Redford, Alexander Pierce","Action, Adventure, Science Fiction",7.671
Spider-Man,2002-05-01,139000000,"Tobey Maguire, Spider-Man / Peter Parker, Willem Dafoe, Green Goblin / Norman Osborn, Kirsten Dunst, Mary Jane Watson, James Franco, Harry Osborn, Cliff Robertson, Ben Parker, Rosemary Harris, May Parker, J.K. Simmons, J. Jonah Jameson, Joe Manganiello, Flash Thompson, Gerry Becker, Maximilian Fargas","Fantasy, Action",7.279
